source_language	source_value	subject_id	predicate_id	translation_language	translation_value	translation_status
en	Tear film break up time (number of seconds that elapse between the last blink and the appearance of the first dry spot in the tear film) below the lower limit of normal.	HP:6000069	IAO:0000115	cs		NOT_TRANSLATED
en	Brief tear break-up time	HP:6000069	rdfs:label	cs		NOT_TRANSLATED
en	A granuloma localized to the skin, that is, a chronic inflammatory manifestation with localized aggregation of histiocytes with or without other inflammatory cells (such as plasma cells, eosinophils, or neutrophils), with or without necrosis, with or without vasculitis, with or without calcification, and with or without foreign bodies. Granulomas may be due to infection or chronic inflammatory disease or reactions to foreign material.	HP:6000070	IAO:0000115	cs		NOT_TRANSLATED
en	Cutaneous granuloma	HP:6000070	rdfs:label	cs		NOT_TRANSLATED
en	Formation of abnormal, extraskeletal bony tissue in the dermis (i.e., the layer of skin that lies beneath the epidermis and above the subcutaneous layer).	HP:6000071	IAO:0000115	cs		NOT_TRANSLATED
en	Heterotopic dermal ossification	HP:6000071	rdfs:label	cs		NOT_TRANSLATED
en	The depth of the outer muscular layer of the small bowel is below the lower limit of normal.	HP:6000072	IAO:0000115	cs		NOT_TRANSLATED
en	Thinning of outer muscular layer of small bowel	HP:6000072	rdfs:label	cs		NOT_TRANSLATED
en	A developmental anomaly of renal lymphatics that results from a failure of the lymphatics to make communication with the rest of the lymph trunks. The abnormal lymphatics thus dilate and form cystic spaces at the renal sinus and in the perinephric space.	HP:6000073	IAO:0000115	cs		NOT_TRANSLATED
en	Renal lymphangiectasia	HP:6000073	rdfs:label	cs		NOT_TRANSLATED
en	A myxoma (benign, locally infiltrative neoplasms arising from mesenchymal origin) localized to the pharynx.	HP:6000074	IAO:0000115	cs		NOT_TRANSLATED
en	Pharyngeal myxoma	HP:6000074	rdfs:label	cs		NOT_TRANSLATED
en	Fibrin thrombi inside subcutaneous arterioles.	HP:6000075	IAO:0000115	cs		NOT_TRANSLATED
en	Subcutaneous arteriolar thrombosis	HP:6000075	rdfs:label	cs		NOT_TRANSLATED
en	Vasculitis (inflammation of blood vessels) in the kidney. Renal vasculitis can be observed with numerous disorders and presents clinically as rapidly progressive glomerulonephritis (RPGN) which is characterized by acute kidney injury (AKI), haematuria and proteinuria. Histological examination of the kidney reveals severe inflammation in the form of crescent formation, glomerular necrosis and vasculitis of small and medium sized vessels within the kidney.	HP:6000076	IAO:0000115	cs		NOT_TRANSLATED
en	Renal vasculitis	HP:6000076	rdfs:label	cs		NOT_TRANSLATED
en	Accumulation of abnormally high amounts of iron in beta cells of the pancreas.	HP:6000077	IAO:0000115	cs		NOT_TRANSLATED
en	Pancreatic islet beta cell iron deposition	HP:6000077	rdfs:label	cs		NOT_TRANSLATED
en	A hamartoma (tissue malformation consisting of an abnormal mixture of constitutive components) originating in the nose.	HP:6000078	IAO:0000115	cs		NOT_TRANSLATED
en	Nasal hamartoma	HP:6000078	rdfs:label	cs		NOT_TRANSLATED
en	A type of metachromasia localized to a peripheral nerve. Metachromasia may be defined as the staining of tissue or tissue components such that the color of the tissue-bound dye complex differs significantly from the color of the original dye complex to give a marked contrast in color. For instance in metachromatic leukodystrophy, bloated Schwann cells, containing granularmetachromatic storage material May display a characteristic yellow green dichroism under crossed polarised light.	HP:6000079	IAO:0000115	cs		NOT_TRANSLATED
en	Metachromatic intraneuronal lipid deposits	HP:6000079	rdfs:label	cs		NOT_TRANSLATED
en	Activity of phosphoserine phosphatase below the lower limit of normal in cultured fibroblasts.	HP:6000080	IAO:0000115	cs		NOT_TRANSLATED
en	Reduced phosphoserine phosphatase activity in cultured fibroblasts	HP:6000080	rdfs:label	cs		NOT_TRANSLATED
en	Activity of alpha-aminoadipic semialdehyde synthase below the lower limit of normal in cultured fibroblasts.	HP:6000081	IAO:0000115	cs		NOT_TRANSLATED
en	Reduced alpha-aminoadipic semialdehyde synthase activity in cultured fibroblasts	HP:6000081	rdfs:label	cs		NOT_TRANSLATED
en	Activity of beta-ureidopropionase in the liver below the lower limit of normal.	HP:6000082	IAO:0000115	cs		NOT_TRANSLATED
en	Reduced hepatic beta-ureidopropionase activity	HP:6000082	rdfs:label	cs		NOT_TRANSLATED
en	Activity of dihydropyrimidinase in the liver below the lower limit of normal.	HP:6000083	IAO:0000115	cs		NOT_TRANSLATED
en	Reduced hepatic dihydropyrimidinase activity	HP:6000083	rdfs:label	cs		NOT_TRANSLATED
en	Fontanelle that is more deeply set than normal. Fontanelles are normally relatively firm and curve only slightly inward. A sunken fontanelle can be a sign of dehydration or marasmus.	HP:6000084	IAO:0000115	cs		NOT_TRANSLATED
en	Sunken fontanelle	HP:6000084	rdfs:label	cs		NOT_TRANSLATED
en	Formation of an angle (tilt) along the shaft of the penis.	HP:6000085	IAO:0000115	cs		NOT_TRANSLATED
en	Angulation of penis	HP:6000085	rdfs:label	cs		NOT_TRANSLATED
en	A past medical history of a procedure or catheterization involving the urethra.	HP:6000086	IAO:0000115	cs		NOT_TRANSLATED
en	History of urethral procedure or catheterization	HP:6000086	rdfs:label	cs		NOT_TRANSLATED
en	Abormal enlargement of the penis owing to accumulation of fluid.	HP:6000087	IAO:0000115	cs		NOT_TRANSLATED
en	Penile swelling	HP:6000087	rdfs:label	cs		NOT_TRANSLATED
en	Activity of the enzyme alpha-1,4-glucosidase activity in muscle tissue is below the lower limit of normal.	HP:6000088	IAO:0000115	cs		NOT_TRANSLATED
en	Reduced muscle alpha-1,4-glucosidase activity	HP:6000088	rdfs:label	cs		NOT_TRANSLATED
en	A brown tumor is a bone lesion that results from bony resorption by excess osteoclastic activity, and replacement by fibrous tissue and giant cells. Brown tumor is an uncommon pathognomonic sign of hyperparathyroidism.	HP:6000089	IAO:0000115	cs		NOT_TRANSLATED
en	Brown tumor	HP:6000089	rdfs:label	cs		NOT_TRANSLATED
en	Flame-figures are composed of a central part consisting of collagen fibers and eosinophilic granules, surrounded by a histiocytic and eosinophilic infiltrate. Subsequently, eosinophils tend to disappear and are replaced by phagocytic granulomas, consisting of histiocytes and sometimes giant cells, around the flame figures.	HP:6000090	IAO:0000115	cs		NOT_TRANSLATED
en	Dermal flame figures	HP:6000090	rdfs:label	cs		NOT_TRANSLATED
en	Applied to a sign or symptom that is present during pregnancy and becomes worse following birth.	HP:6000091	IAO:0000115	cs		NOT_TRANSLATED
en	Postpartum exacerbation	HP:6000091	rdfs:label	cs		NOT_TRANSLATED
en	History of having taken retinoids.	HP:6000092	IAO:0000115	cs		NOT_TRANSLATED
en	Retinoid exposure	HP:6000092	rdfs:label	cs		NOT_TRANSLATED
en	History of having been treated with propylthiouracil.	HP:6000093	IAO:0000115	cs		NOT_TRANSLATED
en	Propylthiouracil exposure	HP:6000093	rdfs:label	cs		NOT_TRANSLATED
en	History of spending a substantial amount of time outdoors with occupation or hobbies related to the outdoors, including hunting, gardening, farming, agriculture, horticulture, miners, working in wet fields.	HP:6000094	IAO:0000115	cs		NOT_TRANSLATED
en	History of outdoor activities	HP:6000094	rdfs:label	cs		NOT_TRANSLATED
en	A sinus tract is an abnormal channel that originates from the skin or a mucous surface to a deep-seated focus of suppuration.	HP:6000095	IAO:0000115	cs		NOT_TRANSLATED
en	Draining sinus tract in skin	HP:6000095	rdfs:label	cs		NOT_TRANSLATED
en	Past medical history of surgical replacement of the cornea with corneal tissue from a donor.	HP:6000096	IAO:0000115	cs		NOT_TRANSLATED
en	Corneal transplant history	HP:6000096	rdfs:label	cs		NOT_TRANSLATED
en	Breakage of the capsule of the lens. This is most often observed as a complication of lens surgery, but this term refers to lens capsule rupture not related to surgery or major trauma.	HP:6000097	IAO:0000115	cs		NOT_TRANSLATED
en	Spontaneous lens capsule rupture	HP:6000097	rdfs:label	cs		NOT_TRANSLATED
en	A past medical history of wearing contact lenses.	HP:6000098	IAO:0000115	cs		NOT_TRANSLATED
en	Contact lens wearer	HP:6000098	rdfs:label	cs		NOT_TRANSLATED
en	Increase in thickness of the mucosa of the airways above the upper limit of normal.	HP:6000099	IAO:0000115	cs		NOT_TRANSLATED
en	Airway mucosal thickening	HP:6000099	rdfs:label	cs		NOT_TRANSLATED
en	Increased (more negative) voltage across the nasal epithelium.	HP:6000100	IAO:0000115	cs		NOT_TRANSLATED
en	Hyperpolarized transepithelial nasal potential difference	HP:6000100	rdfs:label	cs		NOT_TRANSLATED
en	An adhesion between the conjunctiva of the eyelid and the cornea.	HP:6000101	IAO:0000115	cs		NOT_TRANSLATED
en	Corneopalpebral synechiae	HP:6000101	rdfs:label	cs		NOT_TRANSLATED
en	Intraductal papilloma is a benign tumor found within breast ducts. The abnormal proliferation of ductal epithelial cells causes growth. A solitary intraductal papilloma is usually found centrally posterior to the nipple affecting the central duct. Multiple intraductal papillomas are located peripherally, found in any breast quadrant affecting the peripheral ducts.	HP:6000102	IAO:0000115	cs		NOT_TRANSLATED
en	Breast intraductal papilloma	HP:6000102	rdfs:label	cs		NOT_TRANSLATED
en	Precipitous labor is extremely rapid labor and delivery, usually defined as expulsion of the fetus within less than 3 hours of commencement of regular contractions.	HP:6000103	IAO:0000115	cs		NOT_TRANSLATED
en	Precipitous labor	HP:6000103	rdfs:label	cs		NOT_TRANSLATED
en	Maternal history of a pregnancy with two fetuses in the uterus.	HP:6000104	IAO:0000115	cs		NOT_TRANSLATED
en	Twin pregnancy	HP:6000104	rdfs:label	cs		NOT_TRANSLATED
en	A swelling or enlargement localized to the vagina. The word mass is usually used at an early stage of the diagnostic workup before the precise nature of the swelling has been determined.	HP:6000105	IAO:0000115	cs		NOT_TRANSLATED
en	Vaginal mass	HP:6000105	rdfs:label	cs		NOT_TRANSLATED
en	Pain that is elicited by palpation of the region inside of the costovertebral angle, which is formed by the 12th rib and the spine.	HP:6000106	IAO:0000115	cs		NOT_TRANSLATED
en	Costovertebral angle tenderness	HP:6000106	rdfs:label	cs		NOT_TRANSLATED
en	Pain that is elicited by moving the uterine cervix. This finding can be ascertained by pelvic exam. Cervical motion tenderness is a gynecological exam finding that could be indicative of peritoneal infection.	HP:6000107	IAO:0000115	cs		NOT_TRANSLATED
en	Cervical motion tenderness	HP:6000107	rdfs:label	cs		NOT_TRANSLATED
en	Fluid that originates from the urethra that is not urine, pre-ejaculate or semen.	HP:6000108	IAO:0000115	cs		NOT_TRANSLATED
en	Abnormal urethral discharge	HP:6000108	rdfs:label	cs		NOT_TRANSLATED
en	The presence of an extra digital crease in and individual with normal joint anatomy.	HP:6000109	IAO:0000115	cs		NOT_TRANSLATED
en	Supernumerary finger flexion crease	HP:6000109	rdfs:label	cs		NOT_TRANSLATED
en	Refers to a phenotypic abnormality that mainly affect large joints.	HP:6000110	IAO:0000115	cs		NOT_TRANSLATED
en	Large joint predominance	HP:6000110	rdfs:label	cs		NOT_TRANSLATED
en	Refers to a phenotypic abnormality that affects a single joint.	HP:6000111	IAO:0000115	cs		NOT_TRANSLATED
en	Monoarticular	HP:6000111	rdfs:label	cs		NOT_TRANSLATED
en	An abnormality of the upper palmar crease whereby the crease widens and ends between the second and third fingers and is said to resemble a hockey stick.	HP:6000112	IAO:0000115	cs		NOT_TRANSLATED
en	Hockey-stick palmar crease	HP:6000112	rdfs:label	cs		NOT_TRANSLATED
en	The amount of succinyladenosine in the urine, normalized for urine concentration, is above the upper limit of normal.	HP:6000113	IAO:0000115	cs		NOT_TRANSLATED
en	Elevated urinary succinyladenosine level	HP:6000113	rdfs:label	cs		NOT_TRANSLATED
en	The amount of 5-hydroxymethyluracil in the urine, normalized for urine concentration, is above the upper limit of normal.	HP:6000114	IAO:0000115	cs		NOT_TRANSLATED
en	Elevated urinary 5-hydroxymethyluracil level	HP:6000114	rdfs:label	cs		NOT_TRANSLATED
en	The amount of creatinine in the urine, normalized for urine concentration, is below the lower limit of normal.	HP:6000115	IAO:0000115	cs		NOT_TRANSLATED
en	Decreased urine creatinine level	HP:6000115	rdfs:label	cs		NOT_TRANSLATED
en	The amount of deoxyuridine in the urine, normalized for urine concentration, is above the upper limit of normal.	HP:6000116	IAO:0000115	cs		NOT_TRANSLATED
en	Elevated urinary deoxyuridine level	HP:6000116	rdfs:label	cs		NOT_TRANSLATED
en	The amount of dihydrouracil in the urine, normalized for urine concentration, is above the upper limit of normal.	HP:6000118	IAO:0000115	cs		NOT_TRANSLATED
en	Elevated urinary dihydrouracil level	HP:6000118	rdfs:label	cs		NOT_TRANSLATED
en	The amount of dihydrothymine in the urine, normalized for urine concentration, is above the upper limit of normal.	HP:6000119	IAO:0000115	cs		NOT_TRANSLATED
en	Elevated urinary dihydrothymine level	HP:6000119	rdfs:label	cs		NOT_TRANSLATED
en	The amount of sulfatides in the urine, normalized for urine concentration, is above the upper limit of normal. Sulfatides are derived from GalCer via esterification of a sulfate group to 3-hydroxyl of the galactose moiety.	HP:6000120	IAO:0000115	cs		NOT_TRANSLATED
en	Elevated urinary sulfatide level	HP:6000120	rdfs:label	cs		NOT_TRANSLATED
en	The amount of xanthurenic acid in the urine, normalized for urine concentration, is above the upper limit of normal.	HP:6000121	IAO:0000115	cs		NOT_TRANSLATED
en	Elevated urinary xanthurenic acid level	HP:6000121	rdfs:label	cs		NOT_TRANSLATED
en	Presence of N-acetylglucosamine-rich oligosaccharides in the urine.	HP:6000122	IAO:0000115	cs		NOT_TRANSLATED
en	Increased urinary N-acetylglucosamine-rich oligosaccharide level	HP:6000122	rdfs:label	cs		NOT_TRANSLATED
en	The amount of 2'-deoxyadenosine (dAdo) in the urine, normalized for urine concentration, is above the upper limit of normal.	HP:6000123	IAO:0000115	cs		NOT_TRANSLATED
en	Elevated urinary 2'-deoxyadenosine level	HP:6000123	rdfs:label	cs		NOT_TRANSLATED
en	Positive (abnormal) result of the 2,4-dinitrophenylhydrazine urine test, which indicates the presence of alpha-ketoacids in the urine.	HP:6000124	IAO:0000115	cs		NOT_TRANSLATED
en	Positive 2,4-dinitrophenylhydrazine urine test	HP:6000124	rdfs:label	cs		NOT_TRANSLATED
en	The amount of dolichol in the urine, normalized for urine concentration, is above the upper limit of normal.	HP:6000125	IAO:0000115	cs		NOT_TRANSLATED
en	Elevated urinary dolichol level	HP:6000125	rdfs:label	cs		NOT_TRANSLATED
en	The amount of bile acids in the urine, normalized for urine concentration, is below the lower limit of normal.	HP:6000126	IAO:0000115	cs		NOT_TRANSLATED
en	Decreased urinary bile acid level	HP:6000126	rdfs:label	cs		NOT_TRANSLATED
en	The ratio of creatine to creatinine concentration in the urine is above the upper limit of normal.	HP:6000127	IAO:0000115	cs		NOT_TRANSLATED
en	Elevated urinary creatine/creatinine ratio	HP:6000127	rdfs:label	cs		NOT_TRANSLATED
en	The amount of thymidine in the urine, normalized for urine concentration, is below the lower limit of normal.	HP:6000128	IAO:0000115	cs		NOT_TRANSLATED
en	Elevated urinary thymidine level	HP:6000128	rdfs:label	cs		NOT_TRANSLATED
en	The amount of glutarylglycine in the urine, normalized for urine concentration, is below the lower limit of normal.	HP:6000129	IAO:0000115	cs		NOT_TRANSLATED
en	Elevated urinary glutarylglycine level	HP:6000129	rdfs:label	cs		NOT_TRANSLATED
en	Detection of indican in the urine. Urinary indican concentration may be elevated in small bowel bacterial overgrowth. Indican is produced by bacterial deconjugation of dietary tryptophan to indole which is absorbed at all levels of the intestine, but principally from the small bowel.	HP:6000130	IAO:0000115	cs		NOT_TRANSLATED
en	Elevated urinary indican level	HP:6000130	rdfs:label	cs		NOT_TRANSLATED
en	Dacryolith is a concretion (accumulation of sediment) within the nasolacrimal system.	HP:6000131	IAO:0000115	cs		NOT_TRANSLATED
en	Dacrolith	HP:6000131	rdfs:label	cs		NOT_TRANSLATED
en	Activity of gamma-glutamylcysteine synthetase (EC 6.3.2.2) in erythrocytes below the lower limit of normal.	HP:6000132	IAO:0000115	cs		NOT_TRANSLATED
en	Reduced erythrocyte gamma-glutamyl cysteine synthetase activity	HP:6000132	rdfs:label	cs		NOT_TRANSLATED
en	The activity of nicotinamide adenine dinucleotide (NADH)-cytochrome b5 reductase in erythrocytes (red blood cells) is below the lower limit of normal.	HP:6000133	IAO:0000115	cs		NOT_TRANSLATED
en	Decreased erythrocyte nicotinamide adenine dinucleotide-cytochrome b5 reductase activity	HP:6000133	rdfs:label	cs		NOT_TRANSLATED
en	Activity of alpha-methylacyl-CoA racemase (AMACR; EC 5.1.99.4) below the lower limit of normal in cultured fibroblasts.	HP:6000134	IAO:0000115	cs		NOT_TRANSLATED
en	Reduced alpha-methylacyl-CoA racemase activity in cultured fibroblasts	HP:6000134	rdfs:label	cs		NOT_TRANSLATED
en	Volume of semen in ejaculate below the lower limit of normal. This finding can be ascertained by semen analysis. Comment: Sperm are produced within the testis, in the process of spermatogenesis, then travel through the male reproductive tract (the seminiferous tubules, epididymis, vas deferens, prostate and urethra). As the sperm travel, seminal fluid is added from the seminal vesicles, prostate, testis and epididymis and periurethral glands. The function of the ejaculate is to transport sperm into the female genital tract and to provide a suitable environment for sperm survival during this transit.	HP:6000135	IAO:0000115	cs		NOT_TRANSLATED
en	Low semen volume	HP:6000135	rdfs:label	cs		NOT_TRANSLATED
en	Applies to an abnormality that is situated in (or predominant in) the elbow.	HP:6000136	IAO:0000115	cs		NOT_TRANSLATED
en	Elbow localization	HP:6000136	rdfs:label	cs		NOT_TRANSLATED
en	Abnormal enlargement of the visible portion of the distal nail matrix that extends beyond the proximal nail fold, which is referred to as the lunula.	HP:6000137	IAO:0000115	cs		NOT_TRANSLATED
en	Enlarged lunula	HP:6000137	rdfs:label	cs		NOT_TRANSLATED
en	Applies to an abnormality that is situated in (or predominant in) the heel.	HP:6000138	IAO:0000115	cs		NOT_TRANSLATED
en	Heel localization	HP:6000138	rdfs:label	cs		NOT_TRANSLATED
en	Thin, red to reddish-brown lines of blood (hemorrhages) under the nails. Splinter hemorrhages run vertically under the nails.	HP:6000139	IAO:0000115	cs		NOT_TRANSLATED
en	Splinter hemorrhages	HP:6000139	rdfs:label	cs		NOT_TRANSLATED
en	Lateral thrust (LT) refers to an abnormal knee joint motion in the early stance phase where the knee joint center moves laterally. Also known as varus thrust, LR is defined as the dynamic worsening or abrupt onset of varus (bow-leg) alignment as the limb accepts weight (stance phase), with a return to less varus and more neutral alignment during lift-off and the non-weight-bearing (swing) phase of gait, varus thrust is a potent mechanical risk factor for medial knee osteoarthritis progression.	HP:6000140	IAO:0000115	cs		NOT_TRANSLATED
en	Lateral thrust	HP:6000140	rdfs:label	cs		NOT_TRANSLATED
en	A contusion is a region of injured tissue in which blood capillaries have been ruptured without laceration (bruise). Brain contusions are bruises of the cortical surface that damage the surface from the outside inward, producing disruption of tissue and vessels. The term cerebral contusion describes the pathology of focal necrosis and hemorrhage, typically observed in older children, involving particularly cerebral cortex and subcortical white matter. Such lesions are usually found in coup and contrecoup, as well as inferior orbital, frontal, and temporal locations. Cerebral contusions cause permanent damage to tissues of the cerebrum. The etiology of cerebral contusion is trauma to the head.	HP:6000141	IAO:0000115	cs		NOT_TRANSLATED
en	Cerebral contusion	HP:6000141	rdfs:label	cs		NOT_TRANSLATED
en	A mass of accumulated hardened fecal matter.	HP:6000142	IAO:0000115	cs		NOT_TRANSLATED
en	Fecolith	HP:6000142	rdfs:label	cs		NOT_TRANSLATED
en	Appendicitis is an inflammation of the vermiform appendix, which is a hollow organ located at the tip of the cecum, usually in the right lower quadrant of the abdomen.	HP:6000143	IAO:0000115	cs		NOT_TRANSLATED
en	Appendicitis	HP:6000143	rdfs:label	cs		NOT_TRANSLATED
en	A severely scarred portion of infarcted ventricular myocardium that does not contract normally but instead bulges outward while the rest of the ventricle contracts during systole.	HP:6000144	IAO:0000115	cs		NOT_TRANSLATED
en	Left ventricular aneurysm	HP:6000144	rdfs:label	cs		NOT_TRANSLATED
en	An abnormal form of the heart seen upon chest radiography in which the heart displays an upturned apex and slight concave pulmonary artery segment. This configuration is said to resemble a boot.	HP:6000145	IAO:0000115	cs		NOT_TRANSLATED
en	Boot-shaped cardiac silhouette	HP:6000145	rdfs:label	cs		NOT_TRANSLATED
en	Hydrosalpinx is a distension or dilatation of the fallopian tube in the presence of a distal tubal occlusion.	HP:6000146	IAO:0000115	cs		NOT_TRANSLATED
en	Hydrosalpinx	HP:6000146	rdfs:label	cs		NOT_TRANSLATED
en	An increase in the level of 3-methylhex-2,4-dienedioic acid or 3-methylhex-3,4-dienedioic acid in the brain identified by magnetic resonance spectroscopy (MRS).	HP:6000147	IAO:0000115	cs		NOT_TRANSLATED
en	Elevated methylhex-dienedioic level by MRS	HP:6000147	rdfs:label	cs		NOT_TRANSLATED
en	Increased signal (contrast enhancement) surrounding the liver observed on computer tomography or magnetic resonance imaging following administration of contrast agents.	HP:6000148	IAO:0000115	cs		NOT_TRANSLATED
en	Perihepatic enhancement	HP:6000148	rdfs:label	cs		NOT_TRANSLATED
en	The in vitro contracture test determines the sensitivity of freshly obtained skeletal muscle specimens to caffeine or halothane applied to a bathing solution. Muscles from persons susceptible to malignant hyperthermia have lower contracture thresholds for these agents than do normal muscle.	HP:6000149	IAO:0000115	cs		NOT_TRANSLATED
en	Reduced in vitro contracture test threshold	HP:6000149	rdfs:label	cs		NOT_TRANSLATED
en	Reduced strength (amplitude) of the F-wave, which is an electrophysiological artifact produced by antidromic activation of motoneurons following distal electrical stimulation of motor nerve fibers.	HP:6000150	IAO:0000115	cs		NOT_TRANSLATED
en	Reduced F-wave amplitude	HP:6000150	rdfs:label	cs		NOT_TRANSLATED
en	Abnormal increase in size of peroxisomes.	HP:6000151	IAO:0000115	cs		NOT_TRANSLATED
en	Enlarged peroxisomes	HP:6000151	rdfs:label	cs		NOT_TRANSLATED
en	A non-malignant growth, or enlargement, of the adrenal glands, specifically the cortex, although the cortex cannot be definitively identified by conventional imaging. Adrenal cortical hyperplasia is defined radiologically as a non-malignant growth, or enlargement, of the adrenal glands.	HP:6000152	IAO:0000115	cs		NOT_TRANSLATED
en	Adrenocortical hyperplasia	HP:6000152	rdfs:label	cs		NOT_TRANSLATED
en	Accumulation of lymphocytes in the parotid gland. This feature is generally defined as a count of lymphocytes per area that is above normal limits on histopathological examination.	HP:6000153	IAO:0000115	cs		NOT_TRANSLATED
en	Lymphocytic infiltration of the parotid gland	HP:6000153	rdfs:label	cs		NOT_TRANSLATED
en	A granuloma (a focal aggregate of immune cells that forms in response to a persistent inflammatory stimulus) localiyed to the bone marrow. A granuloma characteristically demonstrates the compact organization of mature macrophages, which may or may not be associated with other inflammatory cell types.	HP:6000154	IAO:0000115	cs		NOT_TRANSLATED
en	Bone marrow granuloma	HP:6000154	rdfs:label	cs		NOT_TRANSLATED
en	The presence of intracellular inclusion bodies (aggregates of stainable substances, usually proteins) in neurons.	HP:6000155	IAO:0000115	cs		NOT_TRANSLATED
en	Neuronal intranuclear inclusion bodies	HP:6000155	rdfs:label	cs		NOT_TRANSLATED
en	Wasting (shrinking) of the pancreas.	HP:6000156	IAO:0000115	cs		NOT_TRANSLATED
en	Pancreatic atrophy	HP:6000156	rdfs:label	cs		NOT_TRANSLATED
en	Number (count) of pancreatic acinar cells reduced below normal. This feature can be ascertained by pancreas biopsy.	HP:6000157	IAO:0000115	cs		NOT_TRANSLATED
en	Decreased pancreatic acinar cell density	HP:6000157	rdfs:label	cs		NOT_TRANSLATED
en	An abnormal result of the filipin test. This test is based on the reaction of unesterified cholesterol with fluorescent antibiotic filipin giving a strongly fluorescent, stable cholesterol-filipin complex suitable for in situ detection. An abnormal test result is present if there is a perinuclear accumulation of staining in lysosomal storage organelles (LSOs).	HP:6000158	IAO:0000115	cs		NOT_TRANSLATED
en	Unesterified cholesterol accumulation in cultured fibroblasts	HP:6000158	rdfs:label	cs		NOT_TRANSLATED
en	Accumulation of foamy cells (lipid-laden macrophages) in the parenchyma of the spleen.	HP:6000160	IAO:0000115	cs		NOT_TRANSLATED
en	Splenic lipid-laden macrophage infiltration	HP:6000160	rdfs:label	cs		NOT_TRANSLATED
en	Concentration or activity of N-acetylglutamate synthase in liver tissue below the lower limit of normal.	HP:6000161	IAO:0000115	cs		NOT_TRANSLATED
en	Reduced hepatic N-acetylglutamate synthase activity	HP:6000161	rdfs:label	cs		NOT_TRANSLATED
en	Ingestion of large amounts of licorice.	HP:6000162	IAO:0000115	cs		NOT_TRANSLATED
en	Excessive licorice consumption	HP:6000162	rdfs:label	cs		NOT_TRANSLATED
en	Applies to an abnormality that is situated in (or predominant in) the shoulder.	HP:6000163	IAO:0000115	cs		NOT_TRANSLATED
