source_language	translation_language	subject_id	predicate_id	source_value	translation_value	translation_status
en	nl	HP:0033179	IAO:0000115	An increased concentration of aconitic acid in the blood circulation	An increased concentration of aconitic acid in the blood circulation	NOT_TRANSLATED
en	nl	HP:0033180	IAO:0000115	The appendix testis or hydatid of Morgagni, is a vestigial remnant of the Müllerian duct located on the superior pole of the testicle between the testis and epididymis. Although this appendage has no vital function, it is present in 50% of males. Torsion of twisting of this vestigial remnant can be incredibly painful, but usually requires no medical intervention	The appendix testis or hydatid of Morgagni, is a vestigial remnant of the Müllerian duct located on the superior pole of the testicle between the testis and epididymis. Although this appendage has no vital function, it is present in 50% of males. Torsion of twisting of this vestigial remnant can be incredibly painful, but usually requires no medical intervention	NOT_TRANSLATED
en	nl	HP:0033181	IAO:0000115	Spinal epidural abscess (SEA) is caused by a suppurative infection in the epidural space. The mass effect ofthe abscess can compress and reduce blood flow to the spinal cord, conus medullaris, or cauda equina. Left untreated, the infection can lead to sensory loss,muscle weakness, visceral dysfunction, sepsis, and even death. Early diagnosis is essential to limit mor-bidity and neurologic injury. The classic triad of fever, axial pain, and neurological deficit occurs in as few as 13 percent of patients, highlighting the diagnosticchallenge associated with SEA	Spinal epidural abscess (SEA) is caused by a suppurative infection in the epidural space. The mass effect ofthe abscess can compress and reduce blood flow to the spinal cord, conus medullaris, or cauda equina. Left untreated, the infection can lead to sensory loss,muscle weakness, visceral dysfunction, sepsis, and even death. Early diagnosis is essential to limit mor-bidity and neurologic injury. The classic triad of fever, axial pain, and neurological deficit occurs in as few as 13 percent of patients, highlighting the diagnosticchallenge associated with SEA	NOT_TRANSLATED
en	nl	HP:0033193	IAO:0000115	Swelling of the hepatocyte, rounding of its contour, and alteration of the cytoplasm, which takes on a reticulated, rarified, or flocculant quality. The cytoplasm of the ballooned hepatocytes often contains clumps of eosinophilic ropey material known as Mallory-Denk bodies (MDBs) or Mallory hyaline, which is composed of hyperphosphorylated misfolded intermediate filaments, ubiquitin, and ubiquitin-binding protein P62	Swelling of the hepatocyte, rounding of its contour, and alteration of the cytoplasm, which takes on a reticulated, rarified, or flocculant quality. The cytoplasm of the ballooned hepatocytes often contains clumps of eosinophilic ropey material known as Mallory-Denk bodies (MDBs) or Mallory hyaline, which is composed of hyperphosphorylated misfolded intermediate filaments, ubiquitin, and ubiquitin-binding protein P62	NOT_TRANSLATED
en	nl	HP:0033213	IAO:0000115	An increased in the level of suberic acid in the urine above the normal range. Suberic acid is an alpha,omega-dicarboxylic acid that is the 1,6-dicarboxy derivative of hexane	An increased in the level of suberic acid in the urine above the normal range. Suberic acid is an alpha,omega-dicarboxylic acid that is the 1,6-dicarboxy derivative of hexane	NOT_TRANSLATED
en	nl	HP:0033302	IAO:0000115	An abnormally increased concentration of 4-Hydroxyphenylacetic acid in the blood circulation	An abnormally increased concentration of 4-Hydroxyphenylacetic acid in the blood circulation	NOT_TRANSLATED
en	nl	HP:0033324	IAO:0000115	Increased concentration of homovanillic acid in the blood circulation	Increased concentration of homovanillic acid in the blood circulation	NOT_TRANSLATED
en	nl	HP:0033332	IAO:0000115	An increased concentration of serum amyloid A in the blood circulation	An increased concentration of serum amyloid A in the blood circulation	NOT_TRANSLATED
en	nl	HP:0033332	rdfs:label	Elevated circulating amyloid A	Elevated circulating amyloid A	NOT_TRANSLATED
en	nl	HP:0033363	IAO:0000115	Hyaline membranes are homogeneous eosinophilic material composed of cellular debris, plasma proteins, and surfactantnplastered against alveolar ducts and alveolar walls. The hyaline membranes are deposited along the walls of the alveoli, where gas exchange typically occurs, thereby making gas exchange difficult	Hyaline membranes are homogeneous eosinophilic material composed of cellular debris, plasma proteins, and surfactantnplastered against alveolar ducts and alveolar walls. The hyaline membranes are deposited along the walls of the alveoli, where gas exchange typically occurs, thereby making gas exchange difficult	NOT_TRANSLATED
en	nl	HP:0033436	IAO:0000115	An abnormally increased concentration of 3-methyl-2-oxovaleric acid in the blood circulation	An abnormally increased concentration of 3-methyl-2-oxovaleric acid in the blood circulation	NOT_TRANSLATED
en	nl	HP:0033437	IAO:0000115	Abnormal increase of the concentration of 4-methyl-2-oxopentanoic acid in the blood circulation	Abnormal increase of the concentration of 4-methyl-2-oxopentanoic acid in the blood circulation	NOT_TRANSLATED
en	nl	HP:0033439	IAO:0000115	Increased concentration of decenoylcarnitine in the blood circulation	Increased concentration of decenoylcarnitine in the blood circulation	NOT_TRANSLATED
en	nl	HP:0033440	IAO:0000115	Increased concentration of octenoylcarnitine in the blood circulation	Increased concentration of octenoylcarnitine in the blood circulation	NOT_TRANSLATED
en	nl	HP:0033441	IAO:0000115	Increased concentration of hexanoylcarnitine in the blood circulation	Increased concentration of hexanoylcarnitine in the blood circulation	NOT_TRANSLATED
en	nl	HP:0033442	IAO:0000115	Increased concentration of glutarylcarnitine in the blood circulation	Increased concentration of glutarylcarnitine in the blood circulation	NOT_TRANSLATED
en	nl	HP:0033444	IAO:0000115	Increased concentration of dodecanoylcarnitine in the blood circulation	Increased concentration of dodecanoylcarnitine in the blood circulation	NOT_TRANSLATED
en	nl	HP:0033446	IAO:0000115	Increased concentration of O-butyrylcarnitine in the blood circulation	Increased concentration of O-butyrylcarnitine in the blood circulation	NOT_TRANSLATED
en	nl	HP:0033447	IAO:0000115	Increased concentration of O-isovalerylcarnitine in the blood circulation	Increased concentration of O-isovalerylcarnitine in the blood circulation	NOT_TRANSLATED
en	nl	HP:0033452	rdfs:label	Decreased circulating prealbumin concentration	Decreased circulating prealbumin concentration	NOT_TRANSLATED
en	nl	HP:0033464	IAO:0000115	Increased concentration of 3-hydroxypalmitoleylcarnitine in the blood circulation	Increased concentration of 3-hydroxypalmitoleylcarnitine in the blood circulation	NOT_TRANSLATED
en	nl	HP:0033480	IAO:0000115	Decreased circulation of bilirubin in the blood circulation	Decreased circulation of bilirubin in the blood circulation	NOT_TRANSLATED
en	nl	HP:0033511	rdfs:label	Drug addiction	Drug addiction	NOT_TRANSLATED
en	nl	HP:0033512	IAO:0000115	Addiction to a stimulant drug, defined as a drug that typically increases alertness, attention and energy while also elevating blood pressure, heart rate and breathing	Addiction to a stimulant drug, defined as a drug that typically increases alertness, attention and energy while also elevating blood pressure, heart rate and breathing	NOT_TRANSLATED
en	nl	HP:0033512	rdfs:label	Stimulant addiction	Stimulant addiction	NOT_TRANSLATED
en	nl	HP:0033513	rdfs:label	Cocaine addiction	Cocaine addiction	NOT_TRANSLATED
en	nl	HP:0033514	IAO:0000115	Addiction to amphetamine or dextroamphetamine	Addiction to amphetamine or dextroamphetamine	NOT_TRANSLATED
en	nl	HP:0033514	rdfs:label	Amphetamine addiction	Amphetamine addiction	NOT_TRANSLATED
en	nl	HP:0033515	rdfs:label	Opioid addiction	Opioid addiction	NOT_TRANSLATED
en	nl	HP:0033516	rdfs:label	Benzodiazepine addiction	Benzodiazepine addiction	NOT_TRANSLATED
en	nl	HP:0033517	rdfs:label	Heroin addiction	Heroin addiction	NOT_TRANSLATED
en	nl	HP:0033518	rdfs:label	Methylphenidate addiction	Methylphenidate addiction	NOT_TRANSLATED
en	nl	HP:0033519	rdfs:label	Methamphetamine addiction	Methamphetamine addiction	NOT_TRANSLATED
en	nl	HP:0033520	IAO:0000115	Paradoxical embolism describes the passage of a venous or right-sided cardiac thrombus into the arterial or systemic circulation.nComment: Paradoxical embolism occurs most commonly through an intracardiac defect at the atrial level, but can also be due to another type of right-to-left-shunt, as for example in pulmonary arteriovenous malformations. Paradoxical embolism may lead to serious complications as ischemic stroke	Paradoxical embolism describes the passage of a venous or right-sided cardiac thrombus into the arterial or systemic circulation.nComment: Paradoxical embolism occurs most commonly through an intracardiac defect at the atrial level, but can also be due to another type of right-to-left-shunt, as for example in pulmonary arteriovenous malformations. Paradoxical embolism may lead to serious complications as ischemic stroke	NOT_TRANSLATED
en	nl	HP:0033543	IAO:0000115	Nicotine addition can be defined as chronic compulsive nicotine seeking and continued use despite harmful consequences	Nicotine addition can be defined as chronic compulsive nicotine seeking and continued use despite harmful consequences	NOT_TRANSLATED
en	nl	HP:0033543	rdfs:label	Nicotine addiction	Nicotine addiction	NOT_TRANSLATED
en	nl	HP:0033561	IAO:0000115	The presence of autoantibodies in the blood circulation that react against bactericidal/permeability-increasing protein (BPI). BPI is an endotoxin-binding host protein with important antibacterial effects against Gram-negative bacteria, such as Pseudomonas aeruginosa. nBPI is a 55 kDalton protein that is most abundant in the azurophilic granules of neutrophils. BPI also acts as a target antigen for antineutrophil cytoplasmic autoantibodies	The presence of autoantibodies in the blood circulation that react against bactericidal/permeability-increasing protein (BPI). BPI is an endotoxin-binding host protein with important antibacterial effects against Gram-negative bacteria, such as Pseudomonas aeruginosa. nBPI is a 55 kDalton protein that is most abundant in the azurophilic granules of neutrophils. BPI also acts as a target antigen for antineutrophil cytoplasmic autoantibodies	NOT_TRANSLATED
en	nl	HP:0033627	IAO:0000115	Increased amount of harderoporphyrin in the urine	Increased amount of harderoporphyrin in the urine	NOT_TRANSLATED
en	nl	HP:0033650	IAO:0000115	A parenchymal band is a linear opacity, usually 1-3 mm thick and up to 5 cm long that usually extends to the visceral pleuran(which is often thickened and may be retracted at the site of contact). It reflects pleuroparenchymal fibrosis and is usually associated with distortion of the lung architecture. Parenchymal bands are most frequently encountered in individuals who have been exposed to asbestos	A parenchymal band is a linear opacity, usually 1-3 mm thick and up to 5 cm long that usually extends to the visceral pleuran(which is often thickened and may be retracted at the site of contact). It reflects pleuroparenchymal fibrosis and is usually associated with distortion of the lung architecture. Parenchymal bands are most frequently encountered in individuals who have been exposed to asbestos	NOT_TRANSLATED
en	nl	HP:0033664	IAO:0000115	Gangliogliomas are rare tumours of the central nervous system. The are WHO grade I and considered low grade. They are well differentiated neuroepithelial tumours consisting of both dysplastic neuronal and neoplastic glial cells	Gangliogliomas are rare tumours of the central nervous system. The are WHO grade I and considered low grade. They are well differentiated neuroepithelial tumours consisting of both dysplastic neuronal and neoplastic glial cells	NOT_TRANSLATED
en	nl	HP:0033676	IAO:0000115	A behavioral or psychological symptom that typically occurs following exposure to one or more traumatic events. Posttraumatic stress disorder (PTSD) symptoms include intrusive recollections (re-experiencing the trauma in flashbacks, memories or nightmares); avoidant and numbing symptoms (including diminished emotions and avoidance of situations that are reminders of the traumatic event); and hyperarousal (including increased irritability, exaggerated startle reactions or difficulty sleeping or concentrating)	A behavioral or psychological symptom that typically occurs following exposure to one or more traumatic events. Posttraumatic stress disorder (PTSD) symptoms include intrusive recollections (re-experiencing the trauma in flashbacks, memories or nightmares); avoidant and numbing symptoms (including diminished emotions and avoidance of situations that are reminders of the traumatic event); and hyperarousal (including increased irritability, exaggerated startle reactions or difficulty sleeping or concentrating)	NOT_TRANSLATED
en	nl	HP:0033694	IAO:0000115	The false perception of tactile sensory input that creates a hallucinatory sensation of physical contact with an imaginary object	The false perception of tactile sensory input that creates a hallucinatory sensation of physical contact with an imaginary object	NOT_TRANSLATED
en	nl	HP:0033705	IAO:0000115	A feeling of sadness characterized by crying episodes that can come on suddenly and are not under usual social control	A feeling of sadness characterized by crying episodes that can come on suddenly and are not under usual social control	NOT_TRANSLATED
en	nl	HP:0033706	IAO:0000115	This condition is caused by slow-growing conglomeration of dust particles and collagen deposition in individuals (mostly coal workers) heavily exposed to inorganic dust. Progressive massive fibrosis manifests as masslike lesions, usually bilateral and innthe upper lobes. Background nodular opacities reflect accompanying pneumoconiosis, with or without emphysematous destruction adjacent to the massive fibrosis. Lesions similar to progressive massive fibrosis sometimes occur in other conditions, such as sarcoidosis and talcosis	This condition is caused by slow-growing conglomeration of dust particles and collagen deposition in individuals (mostly coal workers) heavily exposed to inorganic dust. Progressive massive fibrosis manifests as masslike lesions, usually bilateral and innthe upper lobes. Background nodular opacities reflect accompanying pneumoconiosis, with or without emphysematous destruction adjacent to the massive fibrosis. Lesions similar to progressive massive fibrosis sometimes occur in other conditions, such as sarcoidosis and talcosis	NOT_TRANSLATED
en	nl	HP:0033802	IAO:0000115	A type of blistering in which the lesions are located within the epidermis with loss of cell-cell adhesion of keratinocytes. In simplex EB, cleave occurs in the basal layer, which is the innermost layer of the epidermis and consists of a single layer of basal germinative cells (mostly epidermal Keratinocytes) that proliferate and thereby produce new cells for other epidermal layers. As the cells move towards the upper layers of the epidermis they mature and eventually form cornified cells. The suprabasal cell layer lies directly above the basal layer and is composed of five to ten layers of cells	A type of blistering in which the lesions are located within the epidermis with loss of cell-cell adhesion of keratinocytes. In simplex EB, cleave occurs in the basal layer, which is the innermost layer of the epidermis and consists of a single layer of basal germinative cells (mostly epidermal Keratinocytes) that proliferate and thereby produce new cells for other epidermal layers. As the cells move towards the upper layers of the epidermis they mature and eventually form cornified cells. The suprabasal cell layer lies directly above the basal layer and is composed of five to ten layers of cells	NOT_TRANSLATED
en	nl	HP:0033822	IAO:0000115	A mass is any pulmonary, pleural, or mediastinal lesion seen on chest radiographs as an opacity greater than 3 cm in diametern(without regard to contour, border, or density characteristics). Mass usually implies a solid or partly solid opacity. CT allows more exact evaluation of size, location, attenuation, and other features	A mass is any pulmonary, pleural, or mediastinal lesion seen on chest radiographs as an opacity greater than 3 cm in diametern(without regard to contour, border, or density characteristics). Mass usually implies a solid or partly solid opacity. CT allows more exact evaluation of size, location, attenuation, and other features	NOT_TRANSLATED
en	nl	HP:0033917	IAO:0000115	Inflammation of arcuate veins of the kidney, which may involve only the intima or can be transmural	Inflammation of arcuate veins of the kidney, which may involve only the intima or can be transmural	NOT_TRANSLATED
en	nl	HP:0033919	rdfs:label	Medial/intimal arcuate venulitis	Medial/intimal arcuate venulitis	NOT_TRANSLATED
en	nl	HP:0034011	IAO:0000115	A reduced proportion of sperm that move in a straight line or large circles; alternatively, an increaed proportion of sperm that move in tight circles or in some other non-linear fashion	A reduced proportion of sperm that move in a straight line or large circles; alternatively, an increaed proportion of sperm that move in tight circles or in some other non-linear fashion	NOT_TRANSLATED
en	nl	HP:0034018	IAO:0000115	The presence of autoantibodies (immunoglobulins) in the blood circulation that react against a class I human leukocyte antigen (HLA). Class I HLA corresponds to MHC class II (DP, DM, DO, DQ, and DR)	The presence of autoantibodies (immunoglobulins) in the blood circulation that react against a class I human leukocyte antigen (HLA). Class I HLA corresponds to MHC class II (DP, DM, DO, DQ, and DR)	NOT_TRANSLATED
en	nl	HP:0034026	rdfs:label	Elevated circulating sacchoropine concentration	Elevated circulating sacchoropine concentration	NOT_TRANSLATED
en	nl	HP:0034041	rdfs:label	Ventricular ectopy	Ventricular ectopy	NOT_TRANSLATED
en	nl	HP:0034074	IAO:0000115	An abnormally elevated echogenicity of fetal long bones in a prenatal sonographic investigation. Ths finding is due to hypermineralization	An abnormally elevated echogenicity of fetal long bones in a prenatal sonographic investigation. Ths finding is due to hypermineralization	NOT_TRANSLATED
en	nl	HP:0034116	rdfs:label	Anti-thyrotropin receptor antibody	Anti-thyrotropin receptor antibody	NOT_TRANSLATED
en	nl	HP:0034206	IAO:0000115	An anomlous structural finding of the fetal central nervous system. Terms in this subhierarchy are restricted to findings that can only be observed in the prenatal period. Other HPO terms can also be used to describe fetal phenotypes	An anomlous structural finding of the fetal central nervous system. Terms in this subhierarchy are restricted to findings that can only be observed in the prenatal period. Other HPO terms can also be used to describe fetal phenotypes	NOT_TRANSLATED
en	nl	HP:0034207	IAO:0000115	An anomlous structural finding of the fetal gastrointestinal system. Terms in this subhierarchy are restricted to findings that can only be observed in the prenatal period. Other HPO terms can also be used to describe fetal phenotypes	An anomlous structural finding of the fetal gastrointestinal system. Terms in this subhierarchy are restricted to findings that can only be observed in the prenatal period. Other HPO terms can also be used to describe fetal phenotypes	NOT_TRANSLATED
en	nl	HP:0034242	IAO:0000115	An anomlous structural finding of the fetal genitourinary system. Terms in this subhierarchy are restricted to findings that can only be observed in the prenatal period. Other HPO terms can also be used to describe fetal phenotypes	An anomlous structural finding of the fetal genitourinary system. Terms in this subhierarchy are restricted to findings that can only be observed in the prenatal period. Other HPO terms can also be used to describe fetal phenotypes	NOT_TRANSLATED
en	nl	HP:0034243	IAO:0000115	An anomlous structural finding of the fetal lungs. Terms in this subhierarchy are restricted to findings that can only be observed in the prenatal period. Other HPO terms can also be used to describe fetal phenotypes	An anomlous structural finding of the fetal lungs. Terms in this subhierarchy are restricted to findings that can only be observed in the prenatal period. Other HPO terms can also be used to describe fetal phenotypes	NOT_TRANSLATED
en	nl	HP:0034290	IAO:0000115	An increased concentration of tiglylglycine in the blood circulation	An increased concentration of tiglylglycine in the blood circulation	NOT_TRANSLATED
en	nl	HP:0034300	IAO:0000115	Reduced enzyme of acid sphingomyelinase activity in the blood circulation	Reduced enzyme of acid sphingomyelinase activity in the blood circulation	NOT_TRANSLATED
en	nl	HP:0034318	IAO:0000115	Reactivation is the mechanism whereby a latent virus that has infected a host cell switches to a lytic stage, undergoing productive viral replication and allowing the virus to spread. This term refers to reactivation regarded as unusual because of frequency, intensity, location, or nature of the virus, in the sense that the rreactivation would not be observed in an immunocompetent host	Reactivation is the mechanism whereby a latent virus that has infected a host cell switches to a lytic stage, undergoing productive viral replication and allowing the virus to spread. This term refers to reactivation regarded as unusual because of frequency, intensity, location, or nature of the virus, in the sense that the rreactivation would not be observed in an immunocompetent host	NOT_TRANSLATED
en	nl	HP:0034321	IAO:0000115	An increased concentration of guanidinoacetic acid in the blood circulation	An increased concentration of guanidinoacetic acid in the blood circulation	NOT_TRANSLATED
en	nl	HP:0034326	IAO:0000115	Ectopic endometrial tissue within the uterine myometrium	Ectopic endometrial tissue within the uterine myometrium	NOT_TRANSLATED
en	nl	HP:0034335	rdfs:label	Inheritance modifier	Inheritance modifier	NOT_TRANSLATED
en	nl	HP:0034337	IAO:0000115	An abormality of the hand characterized by metacarpophalangeal (MCP) hyperextension and proximal interphalangeal (PIP) and distal interphalangeal (DIP) flexion. The position of the affected hand is said to resemble a claw	An abormality of the hand characterized by metacarpophalangeal (MCP) hyperextension and proximal interphalangeal (PIP) and distal interphalangeal (DIP) flexion. The position of the affected hand is said to resemble a claw	NOT_TRANSLATED
en	nl	HP:0034367	IAO:0000115	Abnormally reduced activity of the enzyme beta-mannosidase, which is a lysosomal enzyme that catabolized oligosaccharides	Abnormally reduced activity of the enzyme beta-mannosidase, which is a lysosomal enzyme that catabolized oligosaccharides	NOT_TRANSLATED
en	nl	HP:0034367	rdfs:label	Decreased beta-mannosidase activity	Decreased beta-mannosidase activity	NOT_TRANSLATED
en	nl	HP:0034379	rdfs:label	Vascular granular osmiophilic material deposition	Vascular granular osmiophilic material deposition	NOT_TRANSLATED
en	nl	HP:0034402	IAO:0000115	A rhabdoid tumor that arises from the kidney. It occurs in children and it is associated with abnormalities of chromosome 22. It is characterized by the presence of cells with a large eccentric nucleus, prominent nucleolus, and abundant cytoplasm	A rhabdoid tumor that arises from the kidney. It occurs in children and it is associated with abnormalities of chromosome 22. It is characterized by the presence of cells with a large eccentric nucleus, prominent nucleolus, and abundant cytoplasm	NOT_TRANSLATED
en	nl	HP:0034434	IAO:0000115	Any abnormal behavior related to communication	Any abnormal behavior related to communication	NOT_TRANSLATED
en	nl	HP:0034434	rdfs:label	Abnormal social communication behavior	Abnormal social communication behavior	NOT_TRANSLATED
en	nl	HP:0034435	IAO:0000115	Any abnormality of eye contact behavior. We define eye contact as a form of nonverbal communication between two individuals who are facing each other in which an individual directs the eyes towards the eyes or face of the other individual. Eye contact occurs frequently and voluntarily during face-to-face verbal communication. The duration and frequency of eye contact that are interpreted to be appropriate may follow social and situational norms	Any abnormality of eye contact behavior. We define eye contact as a form of nonverbal communication between two individuals who are facing each other in which an individual directs the eyes towards the eyes or face of the other individual. Eye contact occurs frequently and voluntarily during face-to-face verbal communication. The duration and frequency of eye contact that are interpreted to be appropriate may follow social and situational norms	NOT_TRANSLATED
en	nl	HP:0034435	rdfs:label	Abnormal eye contact behavior	Abnormal eye contact behavior	NOT_TRANSLATED
en	nl	HP:0034457	IAO:0000115	Increased level of hawkinsin in the urine. Hawkinsin is a cysteine derivative that is cysteine in which the thiol group is substituted by a [2-(carboxymethyl)-2,5-dihydroxycyclohex-3-en-1-yl]sulfanediyl group	Increased level of hawkinsin in the urine. Hawkinsin is a cysteine derivative that is cysteine in which the thiol group is substituted by a [2-(carboxymethyl)-2,5-dihydroxycyclohex-3-en-1-yl]sulfanediyl group	NOT_TRANSLATED
en	nl	HP:0034465	IAO:0000115	An increase in the level of 2-hydroxyadipic acid in the urine	An increase in the level of 2-hydroxyadipic acid in the urine	NOT_TRANSLATED
