source_language	translation_language	subject_id	predicate_id	source_value	translation_value	translation_status
en	nl	HP:0031467	IAO:0000115	A stable tendency to experience negative emotions, i.e., a disposition to experience aversive emotional states	A stable tendency to experience negative emotions, i.e., a disposition to experience aversive emotional states	NOT_TRANSLATED
en	nl	HP:0031468	IAO:0000115	Fears of rejection by and/or separation from significant others, associated with fears of excessive dependency and complete loss of autonomy	Fears of rejection by and/or separation from significant others, associated with fears of excessive dependency and complete loss of autonomy	NOT_TRANSLATED
en	nl	HP:0031469	IAO:0000115	Negative opinion about oneself characterized by low self-confidence and exaggeratedly critical feelings about oneself	Negative opinion about oneself characterized by low self-confidence and exaggeratedly critical feelings about oneself	NOT_TRANSLATED
en	nl	HP:0031469	rdfs:label	Low self esteem	Negatief zelfbeeld	CANDIDATE
en	nl	HP:0031472	IAO:0000115	Engagement in dangerous, risky, and potentially self-damaging activities, unnecessarily and without regard to consequences; lack of concern for one's limitations and denial of the reality of personal danger	Engagement in dangerous, risky, and potentially self-damaging activities, unnecessarily and without regard to consequences; lack of concern for one's limitations and denial of the reality of personal danger	NOT_TRANSLATED
en	nl	HP:0031472	rdfs:label	Risk taking	Risico nemen	CANDIDATE
en	nl	HP:0031473	IAO:0000115	Persistent or frequent angry feelings; anger or irritability in response to minor slights and insults	Persistent or frequent angry feelings; anger or irritability in response to minor slights and insults	NOT_TRANSLATED
en	nl	HP:0031487	IAO:0000115	A vascular malformation located in the lip that is characterized bynectatic papillary dermal capillaries and postcapillary venules in the upper reticular dermis	A vascular malformation located in the lip that is characterized bynectatic papillary dermal capillaries and postcapillary venules in the upper reticular dermis	NOT_TRANSLATED
en	nl	HP:0031525	IAO:0000115	Keratoacanthoma (KA) is a common benign epithelial tumour that originates from the pilosebaceous glands. In most cases, it is characterized by rapid evolution, followed by spontaneous resolution over 4 to 6 months. KA usually presents as a solitary flesh-coloured nodule with a central keratin plug on the sun-exposed skin of elderly individuals	Keratoacanthoma (KA) is a common benign epithelial tumour that originates from the pilosebaceous glands. In most cases, it is characterized by rapid evolution, followed by spontaneous resolution over 4 to 6 months. KA usually presents as a solitary flesh-coloured nodule with a central keratin plug on the sun-exposed skin of elderly individuals	NOT_TRANSLATED
en	nl	HP:0031545	IAO:0000115	Reduced level of T cell receptor excision circle (TRECs) as measured by the TREC assay. Late in maturation, 70% of thymocytes that will ultimately express alpha/beta-T cell receptors form a circular DNA TREC from the excised TCRdelta gene that lies within the TCRalpha genetic locus. The circles are stable but do not increase following cell division and, therefore, become diluted as T cells proliferate. A quantitative polymerase chain reaction (PCR) reaction across the joint of the circular DNA provides the TREC copy number, a marker of newly-formed, antigenically-naïve thymic emigrant T cells	Reduced level of T cell receptor excision circle (TRECs) as measured by the TREC assay. Late in maturation, 70% of thymocytes that will ultimately express alpha/beta-T cell receptors form a circular DNA TREC from the excised TCRdelta gene that lies within the TCRalpha genetic locus. The circles are stable but do not increase following cell division and, therefore, become diluted as T cells proliferate. A quantitative polymerase chain reaction (PCR) reaction across the joint of the circular DNA provides the TREC copy number, a marker of newly-formed, antigenically-naïve thymic emigrant T cells	NOT_TRANSLATED
en	nl	HP:0031588	IAO:0000115	A conspicuously unhappy disposition characterized by negative assumptions, self-defeating talk, fear of failure, and negative ruminations about past events	A conspicuously unhappy disposition characterized by negative assumptions, self-defeating talk, fear of failure, and negative ruminations about past events	NOT_TRANSLATED
en	nl	HP:0031589	IAO:0000115	Frequent thinking about or preoccupation with killing oneself	Frequent thinking about or preoccupation with killing oneself	NOT_TRANSLATED
en	nl	HP:0031602	IAO:0000115	An anomaly in the system of mucociliary transport, which functions to transport the mucous layer lining the respiratory epithelium by ciliary nbeating	An anomaly in the system of mucociliary transport, which functions to transport the mucous layer lining the respiratory epithelium by ciliary nbeating	NOT_TRANSLATED
en	nl	HP:0031799	IAO:0000115	Reduced criculating level of apolipoprotein AI, which is the major protein component of high density lipoprotein (HDL) in plasma. Defects in this gene are associated with HDL deficiencies, including Tangier disease	Reduced criculating level of apolipoprotein AI, which is the major protein component of high density lipoprotein (HDL) in plasma. Defects in this gene are associated with HDL deficiencies, including Tangier disease	NOT_TRANSLATED
en	nl	HP:0031814	IAO:0000115	Repetition of one's own words or phrases	Repetition of one's own words or phrases	NOT_TRANSLATED
en	nl	HP:0031844	IAO:0000115	A sense of intense joy or happiness that is beyond what would be expected under the given circumstances	A sense of intense joy or happiness that is beyond what would be expected under the given circumstances	NOT_TRANSLATED
en	nl	HP:0031849	IAO:0000115	A reversal of sleeping habits with a tendency to sleep during the day and to be awake at night	A reversal of sleeping habits with a tendency to sleep during the day and to be awake at night	NOT_TRANSLATED
en	nl	HP:0031868	IAO:0000115	Difficulty reaching to visually guided goals in peripheral vision, with the deficit leaves voluntary eye movements largely unaffected	Difficulty reaching to visually guided goals in peripheral vision, with the deficit leaves voluntary eye movements largely unaffected	NOT_TRANSLATED
en	nl	HP:0031874	IAO:0000115	A tendency towards rising very late in the morning and going to bed late at night	A tendency towards rising very late in the morning and going to bed late at night	NOT_TRANSLATED
en	nl	HP:0031875	rdfs:label	Abnormal hepcidin level	Abnormal hepcidin level	NOT_TRANSLATED
en	nl	HP:0031876	IAO:0000115	An abnormally reduced concentration of hepcidin in the blood circulation	An abnormally reduced concentration of hepcidin in the blood circulation	NOT_TRANSLATED
en	nl	HP:0031876	rdfs:label	Decreased hepcidin level	Decreased hepcidin level	NOT_TRANSLATED
en	nl	HP:0031877	IAO:0000115	An abnormally increased concentration of hepcidin in the blood circulation	An abnormally increased concentration of hepcidin in the blood circulation	NOT_TRANSLATED
en	nl	HP:0031877	rdfs:label	Elevated hepcidin level	Elevated hepcidin level	NOT_TRANSLATED
en	nl	HP:0031906	rdfs:label	Decreased total hemolytic complement activity	Decreased total hemolytic complement activity	NOT_TRANSLATED
en	nl	HP:0031908	IAO:0000115	Abnormally small sized handwriting defined formally as an impairment of a fine motor skill manifesting mainly as a progressive or stable reduction in amplitude during a writing task	Abnormally small sized handwriting defined formally as an impairment of a fine motor skill manifesting mainly as a progressive or stable reduction in amplitude during a writing task	NOT_TRANSLATED
en	nl	HP:0031937	IAO:0000115	Extreme rapidity of speech	Extreme rapidity of speech	NOT_TRANSLATED
en	nl	HP:0031956	IAO:0000115	An abnormally high concentration in the circulation of aspartate aminotransferase (AST)	An abnormally high concentration in the circulation of aspartate aminotransferase (AST)	NOT_TRANSLATED
en	nl	HP:0031986	IAO:0000115	Irregular, small-amplitude myoclonic movements of the hands and/or fingers on keeping outstretched posture (jerky postural tremor). Polyminimyoclonus is stimulus-sensitive and accentuated during voluntary movements. A cortical origin can be demonstrated by back-averaging techniques, and somatosensory evoked potentials (SSEPs) are sometimes giant	Irregular, small-amplitude myoclonic movements of the hands and/or fingers on keeping outstretched posture (jerky postural tremor). Polyminimyoclonus is stimulus-sensitive and accentuated during voluntary movements. A cortical origin can be demonstrated by back-averaging techniques, and somatosensory evoked potentials (SSEPs) are sometimes giant	NOT_TRANSLATED
en	nl	HP:0032025	IAO:0000115	A reduced concentration of circulating alpha-1 antitrypsin, which is a 52-kDa glycoprotein mainly synthesised and secreted by hepatocytes into the bloodstream. Alpha-1 antitrypsin is a serine-proteinase inhibitor that it is crucial in maintaining protease-antiprotease homeostasis in the lungs	A reduced concentration of circulating alpha-1 antitrypsin, which is a 52-kDa glycoprotein mainly synthesised and secreted by hepatocytes into the bloodstream. Alpha-1 antitrypsin is a serine-proteinase inhibitor that it is crucial in maintaining protease-antiprotease homeostasis in the lungs	NOT_TRANSLATED
en	nl	HP:0032025	rdfs:label	Reduced serum alpha-1-antitrypsin	Reduced serum alpha-1-antitrypsin	NOT_TRANSLATED
en	nl	HP:0032037	IAO:0000115	Mild reduction of the ability to see defined as visual acuity less than 6/12 (20/40 in US notation; 0.5 in decimal notation) but at least 6/18 (20/63 in US notation; 0.32 in decimal notation)	Mild reduction of the ability to see defined as visual acuity less than 6/12 (20/40 in US notation; 0.5 in decimal notation) but at least 6/18 (20/63 in US notation; 0.32 in decimal notation)	NOT_TRANSLATED
en	nl	HP:0032044	IAO:0000115	A reduction in the ability to maintain sustained attention characterized by reduced alertness	A reduction in the ability to maintain sustained attention characterized by reduced alertness	NOT_TRANSLATED
en	nl	HP:0032119	rdfs:label	Narrow angle glaucoma	Narrow angle glaucoma	NOT_TRANSLATED
en	nl	HP:0032223	IAO:0000115	Any of the various types of human blood whose antigen characteristics determine compatibility in transfusion. While the ABO and Rhesus sytems are the most well known, there are in total about 300 different blood type antigens distributed across 34 different blood type systems	Any of the various types of human blood whose antigen characteristics determine compatibility in transfusion. While the ABO and Rhesus sytems are the most well known, there are in total about 300 different blood type antigens distributed across 34 different blood type systems	NOT_TRANSLATED
en	nl	HP:0032227	IAO:0000115	A common, benign skin condition involving hypertrophy of the sebaceous glands characterized by single or multiple lesions that manifest as yellow, soft, small papules with umbilication. The lesions are located commonly on the central face (specifically, the nose, cheeks and forehead) but may also occur elswehere, including the chest, mouth, scrotum, foreskin, penile shaft, vulva, and areola	A common, benign skin condition involving hypertrophy of the sebaceous glands characterized by single or multiple lesions that manifest as yellow, soft, small papules with umbilication. The lesions are located commonly on the central face (specifically, the nose, cheeks and forehead) but may also occur elswehere, including the chest, mouth, scrotum, foreskin, penile shaft, vulva, and areola	NOT_TRANSLATED
en	nl	HP:0032237	IAO:0000115	An abnormally increased number of myelocytes in the peripheral blood circulation. Myelocytes are immature neutrophils with a size of 12-18 micrometers, a round or oval nucleus with no nucleoli, bluish-pink staining cytoplasm with primary and seconday granules, and a nucleus:cytoplasm ratio of 2:1	An abnormally increased number of myelocytes in the peripheral blood circulation. Myelocytes are immature neutrophils with a size of 12-18 micrometers, a round or oval nucleus with no nucleoli, bluish-pink staining cytoplasm with primary and seconday granules, and a nucleus:cytoplasm ratio of 2:1	NOT_TRANSLATED
en	nl	HP:0032238	IAO:0000115	An abnormally increased number of metamyelocytes in the peripheral blood circulation. Metamyelocytes are immature neutrophils with a size of 10-18 micrometers, an indented or kidney-shaped nucleus, pinkish-blue staining cytoplasm with seconday granules, and a nucleus:cytoplasm ratio of 1.5:1	An abnormally increased number of metamyelocytes in the peripheral blood circulation. Metamyelocytes are immature neutrophils with a size of 10-18 micrometers, an indented or kidney-shaped nucleus, pinkish-blue staining cytoplasm with seconday granules, and a nucleus:cytoplasm ratio of 1.5:1	NOT_TRANSLATED
en	nl	HP:0032239	IAO:0000115	An abnormally increased number of band cells in the peripheral blood circulation. Band cells are immature neutrophils with a size of 10-18 micrometers, a horseshoe-shaped nucleus with no nucleoli, light-pink staining cytoplasm with many small seconday granules, and a nucleus:cytoplasm ratio of 1:2	An abnormally increased number of band cells in the peripheral blood circulation. Band cells are immature neutrophils with a size of 10-18 micrometers, a horseshoe-shaped nucleus with no nucleoli, light-pink staining cytoplasm with many small seconday granules, and a nucleus:cytoplasm ratio of 1:2	NOT_TRANSLATED
en	nl	HP:0032248	IAO:0000115	Persistence of virus in the blood circulation longer than would be normal in an immunocompentent host	Persistence of virus in the blood circulation longer than would be normal in an immunocompentent host	NOT_TRANSLATED
en	nl	HP:0032273	IAO:0000115	An abnormally increased concentration of N-Acetylaspartic acid in the blood circulation	An abnormally increased concentration of N-Acetylaspartic acid in the blood circulation	NOT_TRANSLATED
en	nl	HP:0032278	IAO:0000115	An increase in the level of 2-hydroxyglutaric acid in the urine	An increase in the level of 2-hydroxyglutaric acid in the urine	NOT_TRANSLATED
en	nl	HP:0032301	IAO:0000115	Warts affecting the skin in the genital area (peniile shaft, scrotum, vagina, or labia majora). Warts can be small, beginning as a pinhead-size swelling that may become larger and take on a pdenuculated appearance. Warts can spread and coalesce into large masses in the genital or anal area. Their color is variable but tends to be skin colored or darker, and they may occasionally bleed. Warts may cause itching, redness, or discomfort. An outbreak of genital warts may also cause psychological distress	Warts affecting the skin in the genital area (peniile shaft, scrotum, vagina, or labia majora). Warts can be small, beginning as a pinhead-size swelling that may become larger and take on a pdenuculated appearance. Warts can spread and coalesce into large masses in the genital or anal area. Their color is variable but tends to be skin colored or darker, and they may occasionally bleed. Warts may cause itching, redness, or discomfort. An outbreak of genital warts may also cause psychological distress	NOT_TRANSLATED
en	nl	HP:0032304	rdfs:label	Abnormal mannose-binding protein level	Abnormal mannose-binding protein level	NOT_TRANSLATED
en	nl	HP:0032305	IAO:0000115	An abnormal reduction below the normal concentration of mannose-binding protein in the blood circulation	An abnormal reduction below the normal concentration of mannose-binding protein in the blood circulation	NOT_TRANSLATED
en	nl	HP:0032305	rdfs:label	Decreased mannose-binding protein level	Decreased mannose-binding protein level	NOT_TRANSLATED
en	nl	HP:0032306	IAO:0000115	An abnormal elevation above the normal concentration of mannose-binding protein in the blood circulation	An abnormal elevation above the normal concentration of mannose-binding protein in the blood circulation	NOT_TRANSLATED
en	nl	HP:0032306	rdfs:label	Increased mannose-binding protein level	Increased mannose-binding protein level	NOT_TRANSLATED
en	nl	HP:0032347	IAO:0000115	A type of cutaneous amyloidosis that is characterized by hyperpigmented patches with indefinite margins composed of grayish brown macules, often with a reticulated or rippled appearance. Lesions may present as a hyperpigmented patch composed of small brown macules in a rippled or reticulated pattern	A type of cutaneous amyloidosis that is characterized by hyperpigmented patches with indefinite margins composed of grayish brown macules, often with a reticulated or rippled appearance. Lesions may present as a hyperpigmented patch composed of small brown macules in a rippled or reticulated pattern	NOT_TRANSLATED
en	nl	HP:0032352	IAO:0000115	Increased level of methionine in urine	Increased level of methionine in urine	NOT_TRANSLATED
en	nl	HP:0032365	rdfs:label	Exacerbated by aspirin ingestion	Exacerbated by aspirin ingestion	NOT_TRANSLATED
en	nl	HP:0032378	IAO:0000115	Hypersensitivity that is observed within 1 hr of exposures. A variety of adverse reactions can occur within minutes to hours of exposure to a drug. Some can be related to the pharmacological action of the drug (WHO Adverse Reaction Terminology type A for augmented) and usually have a low mortality. Others are not readily predictable based on the structure and pharmacological action of the drug and have a relatively high mortality risk (Type B for bizarre). The most serious form of immediate onset drug hypersensitivity reaction, anaphylaxis. Other reactions including itching,dizziness/light-headedness, nausea, chest discomfort but without any objective skin features, physical signs or physiological compromise. Skin only reactions include generalized erythema, urticaria or angioedema without any sentinel features (see below) of other organ involvement	Hypersensitivity that is observed within 1 hr of exposures. A variety of adverse reactions can occur within minutes to hours of exposure to a drug. Some can be related to the pharmacological action of the drug (WHO Adverse Reaction Terminology type A for augmented) and usually have a low mortality. Others are not readily predictable based on the structure and pharmacological action of the drug and have a relatively high mortality risk (Type B for bizarre). The most serious form of immediate onset drug hypersensitivity reaction, anaphylaxis. Other reactions including itching,dizziness/light-headedness, nausea, chest discomfort but without any objective skin features, physical signs or physiological compromise. Skin only reactions include generalized erythema, urticaria or angioedema without any sentinel features (see below) of other organ involvement	NOT_TRANSLATED
en	nl	HP:0032422	IAO:0000115	Any deviation from the normal concentration of the HDL2a subfraction in the blood circulation. An HDL2B particle is defined as an HDL particle with a size of 9.7-12 nm	Any deviation from the normal concentration of the HDL2a subfraction in the blood circulation. An HDL2B particle is defined as an HDL particle with a size of 9.7-12 nm	NOT_TRANSLATED
en	nl	HP:0032476	rdfs:label	Abnormal circulating vitamin B6 level	Abnormal circulating vitamin B6 level	NOT_TRANSLATED
en	nl	HP:0032477	rdfs:label	Elevated circulating vitamin B6 level	Elevated circulating vitamin B6 level	NOT_TRANSLATED
en	nl	HP:0032501	rdfs:label	Exacerbated by contraceptive medication	Exacerbated by contraceptive medication	NOT_TRANSLATED
en	nl	HP:0032502	rdfs:label	Exacerbated by barbiturate medication	Exacerbated by barbiturate medication	NOT_TRANSLATED
en	nl	HP:0032505	IAO:0000115	Pharyngeal spasms provoked by an attempt to drink	Pharyngeal spasms provoked by an attempt to drink	NOT_TRANSLATED
en	nl	HP:0032514	IAO:0000115	A congenital developmental anomaly characterized by the presence of two (instead of the normal one) lacrimal punctum on one or both sides of the face	A congenital developmental anomaly characterized by the presence of two (instead of the normal one) lacrimal punctum on one or both sides of the face	NOT_TRANSLATED
en	nl	HP:0032514	rdfs:label	Duplicated lacrimal punctum	Duplicated lacrimal punctum	NOT_TRANSLATED
en	nl	HP:0032516	IAO:0000115	Infection that extends deeply into the dermins by dermatophytes, fungi that typically cause different types of superficial infection (tinea) or skin, hair, or nails	Infection that extends deeply into the dermins by dermatophytes, fungi that typically cause different types of superficial infection (tinea) or skin, hair, or nails	NOT_TRANSLATED
en	nl	HP:0032525	rdfs:label	Aggravated by acetylcholinesterase inhibitor	Aggravated by acetylcholinesterase inhibitor	NOT_TRANSLATED
en	nl	HP:0032538	IAO:0000115	A groove or crease on the shins (pretibial, i.e., over the shin bone). Pretibial creases may be obvious at birth and may range from 3 cm to over 15 cm in length and lenghten as the limb grows. They appear as an elongated dimple because of the attachment of skin to underlying tissue (e.g., to the tibia). The dimple or crease grows in proportion to the growth of the leg	A groove or crease on the shins (pretibial, i.e., over the shin bone). Pretibial creases may be obvious at birth and may range from 3 cm to over 15 cm in length and lenghten as the limb grows. They appear as an elongated dimple because of the attachment of skin to underlying tissue (e.g., to the tibia). The dimple or crease grows in proportion to the growth of the leg	NOT_TRANSLATED
en	nl	HP:0032641	IAO:0000115	Interstital aggregates of histiciocytes, occasionally multinucleated with associated lymphoplasmacytic and occcasionally eosinophilic inflammation. Organization can range from poorly-to-well defined and multinucleated giant cells may be present	Interstital aggregates of histiciocytes, occasionally multinucleated with associated lymphoplasmacytic and occcasionally eosinophilic inflammation. Organization can range from poorly-to-well defined and multinucleated giant cells may be present	NOT_TRANSLATED
en	nl	HP:0032642	IAO:0000115	An organized collection of histiocytes (specifically macrophages) localized in the interstitial tissue of the kidney. Through light microscopy, the activated histiocytes appear as epithelioid cells with round to oval nuclei, often with irregular contours and abundant granular eosinophilic cytoplasm with indistinct cell borders. They may also coalesce to form multinucleated giant cells. Granulomas may be associated with a peripheral cuff of lymphoplasmacytic and occcasionally eosinophilic inflammation. Organization can range from poorly-to-well defined. Granulomas can present as necrotizing or non-necrotizing. Microscopically, necrotizing granulomas distinctly have central necrosis with a palisaded lymphohistiocytic reaction and a cuff of chronic inflammation	An organized collection of histiocytes (specifically macrophages) localized in the interstitial tissue of the kidney. Through light microscopy, the activated histiocytes appear as epithelioid cells with round to oval nuclei, often with irregular contours and abundant granular eosinophilic cytoplasm with indistinct cell borders. They may also coalesce to form multinucleated giant cells. Granulomas may be associated with a peripheral cuff of lymphoplasmacytic and occcasionally eosinophilic inflammation. Organization can range from poorly-to-well defined. Granulomas can present as necrotizing or non-necrotizing. Microscopically, necrotizing granulomas distinctly have central necrosis with a palisaded lymphohistiocytic reaction and a cuff of chronic inflammation	NOT_TRANSLATED
en	nl	HP:0032643	IAO:0000115	Interstital aggregates of histiciocytes, occasionally multinucleated with associated lymphoplasmacytic and occcasionally eosinophilic inflammation. Organization can range from poorly-to-well defined and multinucleated giant cells may be present with no necrosis	Interstital aggregates of histiciocytes, occasionally multinucleated with associated lymphoplasmacytic and occcasionally eosinophilic inflammation. Organization can range from poorly-to-well defined and multinucleated giant cells may be present with no necrosis	NOT_TRANSLATED
en	nl	HP:0032649	IAO:0000115	A type of flat-foot characterized by hindfoot abductovalgus, metatarsus adductus, and Achilles tendon shortening. The predominant radiographic findings include forefoot adduction with lateral subluxation of the navicular on the talus and heel valgus. Very abnormal shoe wear is noted on the medial side. Calluses occurunder the metatarsal heads and thehead of the plantar-flexed talus	A type of flat-foot characterized by hindfoot abductovalgus, metatarsus adductus, and Achilles tendon shortening. The predominant radiographic findings include forefoot adduction with lateral subluxation of the navicular on the talus and heel valgus. Very abnormal shoe wear is noted on the medial side. Calluses occurunder the metatarsal heads and thehead of the plantar-flexed talus	NOT_TRANSLATED
en	nl	HP:0032660	IAO:0000115	A type of status epilepticus characterized by a prolonged bilateral tonic-clonic seizure, or repeated bilateral tonic-clonic seizures without recovery between.ncomment: nsource: nseeAlso: Tonic-clonic status epilepticus	A type of status epilepticus characterized by a prolonged bilateral tonic-clonic seizure, or repeated bilateral tonic-clonic seizures without recovery between.ncomment: nsource: nseeAlso: Tonic-clonic status epilepticus	NOT_TRANSLATED
