LNDB ID	LNDB Name	HPO ID	HPO Name	Mapping status	Comment
32.26.02	EMG, Anterior Horn Cell Fallout	HP:0006802	Abnormality of the anterior horn cell	Good	0
32.26.08	Small fibre studies abnormal	HP:0000759	Abnormality of the peripheral nervous system	Good	0
32.26.09	Slow motor conduction: abn. myelin	HP:0003431	Decreased motor nerve conduction velocity	Good	0
32.26.11	Motor conduction block	HP:0012078	Motor conduction block	Good	0
32.26.13	Fibrillation/increased insertional activity	HP:0010546	Muscle fibrillation	Good	0
32.26.14	Central motor conduction abnormal	HP:0012079	Abnormality of central motor conduction	Good	0
32.26.17	EP flash visual abnormal (not enlarged)	HP:0007928	Abnormal flash visual evoked potentials	Good	0
32.26.24	EP brainstem auditory abnormal (central)	HP:0006958	Abnormal auditory evoked potentials	OK	0
32.26.25	EP brainstem auditory abnormal (peripheral)	HP:0006958	Abnormal auditory evoked potentials	OK	0
32.26.26	Auditory evoked potentials abnormal (other)	HP:0006958	Abnormal auditory evoked potentials	Good	0
32.27.00	NERVE BIOPSY, general abnormalities	HP:0000759	Abnormality of the peripheral nervous system	OK	mapped to more general parent term
32.29.00	CONJUNCTIVAL  BIOPSY, general abnormalities	HP:0000502	Abnormality of the conjunctiva	Good	0
32.30.00	MUSCLE BIOPSY, general abnormalities	HP:0003011	Abnormality of the musculature	Good	0
32.30.08	Vacuoles including rimmed vacuoles	HP:0003805	Rimmed vacuoles	Good	0
32.30.09	Pyknotic nuclear clumps	HP:0004303	Abnormality of muscle fibers	?	0
32.30.22	Central cores/core-like lesions/multicores	HP:0003789	Minicore (multicore) myopathy	Good	0
32.30.25	Abnormal mitochondria (EM) - see also MITOCHONDR	HP:0008316	Abnormal mitochondria in muscle tissue	Good	0
32.31.00	NEURORADIOLOGY, general abnormalities	HP:0000707	Abnormality of the nervous system	Good	0
32.31.05	Basal ganglia lesion (for calcif see elsewhere)	HP:0002134	Abnormality of the basal ganglia	OK	0
32.31.10	Cerebellum-large	HP:0012081	Enlarged cerebellum	Good	0
32.31.21	Subdural fluid/hematoma	HP:0100309	Subdural hemorrhage	OK	0
32.34.11	Choroid plexus tumours/cysts	HP:0007376	Abnormality of the choroid plexus	OK	0
32.34.13	Hamartoma/teratoma of the brain	HP:0100006	Neoplasm of the central nervous system	OK	0
32.35.00	MICROSCOPIC CHANGES OF THE CNS, general abnorm	HP:0002011	Abnormality of the central nervous system	OK	mapped to more general parent term
32.35.15	Amyloid deposits	HP:0100256	Senile plaques	Ok	consider Cerebral amyloid angiopathy
32.35.23	Lewy or Hirano bodies	HP:0100314	Cerebral inclusion bodies	OK	Indivudal terms for Hirano & Lewy are also available
32.35.24	Pick agyrophilic inclusions	HP:0100317	Agyrophilic inclusion bodies	OK	0
32.35.29	Eosinophilic inclusions	HP:0100314	Cerebral inclusion bodies	OK	0
32.35.30	Agyrophilic grains	HP:0100317	Agyrophilic inclusion bodies	OK	0
32.35.34	Granular layer atrophy of cerebellum	HP:0012080	Cerebellar granular layer atrophy	Good	0
32.35.35	Purkinje layer atrophy of the cerebellum	HP:0012082	Cerebellar Purkinje layer atrophy	Good	0
32.35.37	Ubiquitin positive inclusions	HP:0012082	Cerebellar Purkinje layer atrophy	Good	0
34.01.25	Excessive skin folds/grooves	HP:0008067	Abnormally lax or hyperextensible skin	?	Is this different from cutis laxa?
34.02.00	Patchy skin defects, general abnormalities	HP:0000951	Abnormality of the skin	OK	0
34.02.02	Patchy aplasia/hypoplasia of skin	HP:0008065	Aplasia/Hypoplasia of the skin	OK	0
34.02.03	Skin atrophy - patchy	HP:0004334	Dermal atrophy	OK	0
04.03.02	Patchy depigmentation of hair/white forelock	HP:0002211	White forelock	OK	Compound term in LDDB
05.01.00	Forehead, prominent etc., general abnormalities	HP:0000290	Abnormality of the forehead	OK	LDD term too imprecise to be mapped (just map that to Abnormality of the forehead?)
05.02.00	Forehead, small etc., general abnormalities	HP:0000290	Abnormality of the forehead	OK	LDD term too imprecise to be mapped (just map that to Abnormality of the forehead?)
06.01.13	Rigid ears	HP:0000356	Abnormality of the outer ear	?	What does this refer to? ?  Note: a more general HPO term is used here.
06.04.02	Narrow/atretic auditory canal	HP:0000402	Stenosis of the external auditory canal	Good	Note that these two LDDB categories overlap
06.07.03	Over-folded ear helix, lop ear	HP:0000356	Abnormality of the outer ear	OK	Note: This LDD category comprises two different entities.Lop ears (HP:0000394) and Overfolded helices (HP:0000396) a more general HPO term is used here.
06.11.01	Temporal bone aplasia/dysplasia	HP:0009911	Abnormality of the temporal bone	OK	Note: LDDB description encompasses two entities, therefore, a more general HPO term is used here.
06.11.02	Cochlear/saccular abnormalities	HP:0000375	Abnormality of cochlea	OK	Note: LDDB description encompasses two entities, here just the HPO term for cochlea is used.
07.06.06	Iris atrophy/dysplasia	HP:0001089	Iris atrophy	OK	Note: term is composite
07.07.03	Size or shape of lens abnormal	HP:0000517	Abnormality of the lens	OK	Note: LDDB Term too general
07.09.00	Optic disc and nerve, general abnormalities	HP:0000587	Abnormality of the optic nerve	OK	Note: LDDB category encompasses two entities
07.10.03	Size or movement of pupil abnormal	HP:0000615	Abnormality of the pupil	OK	Note: Compound LDDB term, needs to be split int two
07.11.01	Aplasia or dysplasia of retina	HP:0000479	Abnormality of the retina	OK	Note: Composite LDDB term: Aplasia of the retina (HP:0010728) or Retinal dysplasia (HP:0007973)
07.11.05	Phakoma/pseudoglioma of retina	HP:0000479	Abnormality of the retina	OK	mapped to more general parent term. Is retinal phakoma and old designation for  retinal nodular hamartoma?
07.11.06	Retinitis pigmentosa/pig retinop/chorioretinitis	HP:0000510	Retinitis pigmentosa	OK	The LDD category encompasses at least 3 HPO terms
07.13.10	Polyopia	HP:0000651	Diplopia	OK	Since LDDB does not have a category DIPLOPIA, I assume that this was meant here?
08.00.00	EYES, ASSOCIATED STRUCTURES	HP:0000478	Abnormality of the eye	OK	general term (parent for 08.00.00 to 08.07.02)
08.02.01	Absent or sparse eyelashes	HP:0000653	Sparse eyelashes	OK	Could also be Absent eyelashes (HP:0000561)
08.04.02	Nasolacrimal duct, abnormal position	HP:0010748	Ectopic lacrimal punctum	Good	to our best knowledege the abnormal position in this case is usually refered to as position of the lacrimal punctum and not the duct as such
08.06.00	Periorbital skin, general abnormalities	HP:0000606	Abnormality of the periorbital region	OK	Not an exact synonym!
08.06.05	Sagging peri-orbital skin/blepharochalasis	HP:0010749	Blepharochalasis	OK	Composite LDDB term: Dermatochalasis (HP:0010750) and Blepharochalasis (HP:0010749)
08.06.06	Peri-orbital tumours/cysts	HP:0000606	Abnormality of the periorbital region	OK	Composite LDDB term; The closesed we have is: Cysts of the eyelid (HP:0010604)
09.01.02	Choanal atresia/stenosis	HP:0000453	Choanal atresia	OK	Composite LDDB term, there is also Choanal stenosis (HP:0000452)
09.06.06	Long nasal septum	HP:0000419	Abnormality of the nasal septum	?	A Long nasal septum is either a Long columella (HP:0009765) or due to a Long nose (HP:0003189) depending on whether a long nasal septum extends unusually low below the level of the ala nasi or not.
09.08.02	Nasal haemangioma	HP:0000329	Facial hemangioma	OK	Is there a reason not to use Facial hemangioma (HP:0000329)?
09.08.03	Nasal telangiectasia	HP:0007380	Facial telangiectasia	?	Does this mean Nasal mucosa telangiectases (HP:0000434) ? probably not exclusively as you can also have teleangiectasia of the skin of the nose which may be even more common than those affecting the nasal mucosa
09.08.04	Nasal tumours/polyps/papillomata	HP:0000462	Nasal polyps	OK	The LDD category encompasses at least 3 HPO terms
10.05.07	Tumour or cyst of the mandible	HP:0000277	Abnormality of the mandible	OK	imprecise: either tumor or cyst
11.02.02	Drooping of lower lip	HP:0000232	Everted lower lip vermilion	?	what is meant? We have Everted lower lip (HP:0000232) or Protruding lower lip (HP:0002712) or does this refer to an abnormal form/position of the mandible leading to the appearance of a ﾄdroopingﾓ lower lip?
11.03.04	Simple/absent philtrum	HP:0005326	Hypoplastic philtrum	OK	Probably Hypoplastic philtrum (HP:0005326); simple is very imprecise whereas absent is not really possible
11.04.04	Thick upper lip	HP:0000215	Thick upper lip vermilion	OK	What is the different between prominent and thick upper lip? Should there be two terms or can this be a synonym of the prominent upper lip?
12.03.03	Periodontoclasis	HP:0000704	Periodontitis	?	Is this word still in current use?
13.01.01	Advanced tooth eruption/development	HP:0006288	Advanced eruption of teeth	OK	Does this mean Premature eruption of teeth (HP:0006288)
13.01.04	Dental cysts/tumours	HP:0000164	Abnormality of the teeth	?	Compound description. Consider HP:0100612,  Odontogenic neoplasm
13.01.07	Irregular or crowded teeth	HP:0000692	Misalignment of teeth	OK	Compound LDDB term, needs to be split int two:For mapping use term Abnormality of teeth spacing
15.01.01	Branchial cleft/sinus/cysts	HP:0009796	Branchial cyst	?	Check whether mapping is too narrow; Terminology is somewhat mixed up in this area!
15.01.03	Low posterior/trident hairline	HP:0002162	Low posterior hairline	?	What is trident hairline?
16.01.01	Gibbus	HP:0002808	Kyphosis	OK	This term is somewhat imprecise. Where is the gibbus? Is there an advantage to this term as opposed to kyphosis as a general term?
16.02.05	Sacral teratoma/tumour	HP:0009793	Presacral teratoma	OK	LDDB term is compound. The HPO term only encompasses teratoma
16.03.01	Atlanto/axial/occipital abnormalities	HP:0003413	Atlantoaxial abnormality	OK	Probably Atlantoaxial abnormality (HP:0003413). But why mix up occipital abnormalities here?
17.01.06	Narrow thorax/funnel chest	HP:0000774	Narrow chest	?	a funnel chest is a synonym of Pectus excavatum 17.01.04
17.01.09	Asternia or bifid sternum	HP:0000766	Abnormality of the sternum	OK	Compound LDDB term : Asternia (HP:0010308) and Bifid sternum (HP:0010309)
17.01.11	Pleural effusion/chylothorax	HP:0002202	Pleural effusion	OK	Compound LDDB term : Pleural effusion (HP:0002202) or Chylothorax (HP:0010310)
17.02.06	Breast tumours	HP:0100013	Neoplasm of the breast	Good	Presumably by breast tumours this includes benign tumours such as fibroadenoma of the breast? The HP term Tumours of the breast is the parent term of breast cancer and fibromas of the breast
17.05.07	Coarctation/interrupted aorta	HP:0001680	Coarctation of aorta	OK	This LDD category comprises two different entities. At the moment, the mappimng just has coarctation.
17.05.29	Tumours of the heart	HP:0009729	Cardiac rhabdomyoma	OK	usually only Cardiac rhabdomyoma occur HP:0009729
17.06.01	Apnoea or tachypnoea	HP:0002795	Functional respiratory abnormality	OK	two terms: Apnea HP:0002104; Tachypnea HP:0002789
17.06.04	Lung cysts	HP:0005948	Cystic lung disease	OK	This may be too general. What type of cyst is meant?
17.06.07	Pulmonary segmentation defects	HP:0002101	Abnormal lung lobation	OK	Is this the same as HP:0002101 (Abnormal lung lobation)
17.06.08	Trachea or laryngeal anomalies	HP:0002087	Abnormality of the upper respiratory tract	OK	Abnormality of the trachea (HP:0002778) and Abnormality of the larynx (HP:0001600)
17.06.09	Tracheal or laryngeal calcification	HP:0010766	Ectopic calcification	?	Laryngeal calcifications (HP:0008754) or Tracheal ectopic calcification (HP:0002787)
17.09.02	Beaded/wavy/constrictions of ribs	HP:0000923	Beaded ribs	OK	Beaded ribs (HP:0000923): Is the same thing meant?
17.09.06	Gaps in ribs	HP:0006655	Rib segmentation abnormalities	OK	What kind of gaps? HPO has: Rib segmentation abnormalities HP:0006655
17.11.00	Shoulder shape, general abnormalities	HP:0003043	Abnormality of the shoulder	OK	Abnormality of the shoulder (HP:0003043) ?
18.01.02	Small bowel atresia/absence/obstruction/short	HP:0002244	Abnormality of the small intestine	OK	Composite LDDB term: HPO has Duodenal atresia (HP:0002247)
18.01.05	Intestinal duplication	HP:0100668	Intestinal duplication	Good	0
18.01.17	Gastrointestinal tumour/polyp/haemangioma	HP:0007378	Neoplasm of the gastrointestinal tract	OK	0
18.05.00	Liver/biliary system, general abnormalities	HP:0001392	Abnormality of the liver	OK	Abnormality of the liver HP:0001392  and Abnormality of the biliary system HP:0004297 (in the HPO Abnormality of the biliary system is a child of Abnormality of the liver)
18.05.03	Liver cysts/tumours/angiomas	HP:0001392	Abnormality of the liver	OK	Composite LDDB Term!
18.05.04	Absent/abnormal gallbladder	HP:0005264	Abnormality of the gallbladder	OK	Abnormality of the gallbladder (HP:0005264)
18.06.01	Oesophageal atresia or stenosis	HP:0002031	Abnormality of the esophagus	OK	Composite LDDB Term! Esophageal atresia (HP:0002032) and Esophageal stenosis (HP:0010450)
18.07.05	Malformation of the pancreas	HP:0001732	Abnormality of the pancreas	OK	Rather inexact. The HPO has Annular pancreas (HP:0001734)
18.08.01	Splenic abnormalities, unspecified	HP:0001743	Abnormality of the spleen	OK	Probably also HP:0001743. No need for two terms like this?
18.09.03	Stomach tumours	HP:0006753	Neoplasm of the stomach	OK	0
20.01.01	Ambiguous/absent genitalia	HP:0000078	Abnormality of the genital system	OK	Composite LDDB Term! Ambiguous genitalia (HP:0000062) Absent external genitalia (HP:0000042)
20.01.07	46, XX with Wolffian structures	HP:0010460	Abnormality of the female genitalia	OK	This is a diagnosis rather than a phenotypic feature ? perhaps we can just say that in 46,XX we have an abnormality of the ﾄfemaleﾓ genitalia and vice versa
20.01.08	46, XY with Mullerian structures	HP:0010461	Abnormality of the male genitalia	OK	This is a diagnosis rather than a phenotypic feature ? perhaps we can just say that in 46,XY we have an abnormality of the ﾄmaleﾓ genitalia and vice versa
20.02.06	Fused labia	HP:0000063	Fused labia minora	OK	Presumably = Fused labia minora (HP:0000063)
20.02.13	Malformed uterus	HP:0000130	Abnormality of the uterus	OK	Very general LDDB term. HPO has Abnormality of the uterus (HP:0000130) as well as a number of specific terms for malformations
20.02.15	Vaginal septum/duplication/hydrometrocolpos	HP:0000142	Abnormality of the vagina	OK	Composite LDDB Term! Septate vagina (HP:0001153), Do we need to define hydrometrocolpos more exactly?
21.01.05	Mucopolysacchariduria/oligosacchariduria	HP:0001939	Abnormality of metabolism/homeostasis	?	Composite LDDB Term! Mucopolysacchariduria (HP:0003567) and Oligosacchariduria (HP:0010471)
21.01.08	Pyuria	HP:0012085	Pyuria	Good	0
21.01.09	Abnormal urinary colour	HP:0012086	Abnormal urinary color	Good	0
21.01.10	Abnormal urinary odour	HP:0012088	Abnormal urinary odor	Good	0
21.03.03	Single renal cysts	HP:0000107	Renal cysts	OK	Meaning unclear, if single, why the plural form of cysts?
21.03.05	Ectopic/supernumerary kidneys	HP:0000077	Abnormality of the kidney	?	Composite LDDB Term! Ectopic kidney (HP:0000086) also Renal duplication (HP:0000075).
21.03.09	Nephritis or nephropathy	HP:0000077	Abnormality of the kidney	OK	Composite LDDB Term! Nephritis (HP:0000123) and Nephropathy (HP:0000112)
22.01.03	Asymmetric arms	HP:0002817	Abnormality of the upper limb	?	Wouldnt it be better to say asymmetric shortening or asymmetric hypertrophy? Consider Hemihypertrophy of upper limb
22.01.10	Proportionate short arms	HP:0009824	Hypoplasia involving bones of the upper limbs	*	There are a number of HPO terms that cover this including Hypoplasia involving bones of the upper limbs and other more detailed terms. (HP:0009824)
22.04.03	Limited movement/flexion deformity of elbow	HP:0002987	Elbow flexion contracture	OK	Composite LDDB Term! Limited elbow movement (HP:0002996) and Elbow contractures (HP:0002987)
22.06.02	Flexion deformity at wrist	HP:0001239	Wrist flexion contracture	Good	Composite LDDB Term! Limited wrist movement (HP:0006248) and Wrist contractures (HP:0001239)
23.01.06	Oedema of hands	HP:0007514	Edema of the dorsum of hands	Good	
23.02.02	Dislocated carpals	HP:0006092	Malaligned carpal bone	OK	Help with this one. There is an HPO term Malaligned carpal bone (HP:0006092) which would seem to overlap. Can you provide a good definition for the LDDB term disocated carpals?
23.04.10	Overlapping fingers (trisomy 18-like)	HP:0010557	Overlapping fingers	OK	0
23.04.14	Limited movement of fingers	HP:0005651	Flexion contracture of finger	?	-The HPO has Joint contractures of the fingers (HP:0009472). Is there a need for another term?
23.04.18	Thick fingers	HP:0001500	Broad finger	OK	The HPO has Broad fingers (HP:0001500), which presumably refers to the same appearance.
23.04.20	Absent finger tips	HP:0009881	Aplasia of the distal phalanges of the hand	?	Does this exist? Or does this mean something like Aplasia of the distal phalanges of the hand (HP:0009881)
23.04.21	Wide finger tips	HP:0001217	Clubbing	OK	Is this meant to be distincrt from clubbing (HP:0001217)?
23.05.02	Accessory metacarpals/pseudo-epiphyses	HP:0005917	Supernumerary metacarpal bones	OK	Compound term: The HPO has: Supernumerary metacarpal bones (HP:0005917) and Pseudoepiphyses of the metacarpals (HP:0009193)
23.05.07	Wide metacarpals/modelling defect	HP:0005916	Abnormal metacarpal morphology	OK	This seems to be a compound term again as the HPO has Broad metacarpals (HP:0001230) and Widened metacarpal shaft (HP:0006012)
23.06.06	Narrow phalanges	HP:0001238	Slender finger	?	This is the Elements term that is closest, please check#
23.06.11	Phalanges, bifid	HP:0009999	Partial duplication of the phalanx of hand	?	There are several terms for specific bifid phalanges. Bifid implies that the duplication is only partial and the HPO term Partial duplication of the phalanges of the hand (HP:0009999) does not include complete duplications of phalanges ﾖ is this really what ios meant by this LDDB term? However, I wonder if this LDDB term implies that all phalanges are bifid (must be rare) or merely that at least one is?
23.07.08	Varus deformity of thumb	HP:0001172	Abnormality of the thumb	?	Hitchhiker thumb in Elements?
23.07.09	Valgus deformity of thumb	HP:0001172	Abnormality of the thumb	?	Adducted thumb in Elements?
24.01.04	Abnormal coloured nails	HP:0100643	Abnormality of nail color	Good	0
24.01.05	Concave nails	HP:0001598	Concave nail	Good	Koilonychia (HP:0001598) is probably meant here?
25.01.03	Asymmetric lower limbs	HP:0002814	Abnormality of the lower limb	?	HPO has Asymmetric leg shortening (HP:0005618), do we need to further elaborate? Request for comments
25.01.09	Reduction deformity of legs, some digits	HP:0006493	Aplasia/Hypoplasia involving bones of the lower limbs	?	This is a really much to general term: does this mean femur or tibia and fibula or some toes missing? The HPO term Aplasia/Hypoplasia involving bones of the lower limbs (HP:0006493) subsumes all those but unfortunately also includes terms such as Peromelia which would belong to the LDDB-term Reduction deformity of legs, no digits
25.01.11	Proportionate shortening of lower limb	HP:0009816	Hypoplasia involving bones of the lower limbs	?	There are a number of HPO terms that cover this including other more detailed terms.
25.03.06	Bifid distal femur	HP:0010443	Bifid femur	OK	Are all cases of Bifid femur (HP:0010443) distal, or do we need a new term?
26.01.05	Absent feet	HP:0009820	Lower limb peromelia	OK	Peromelia of the lower limbs: The distal parts of the lower limbs are missing leading to a stump formation.
26.01.10	Prominent heels	HP:0001838	Vertical talus	?	What exactly does this stand for: Consider a more precise definition
26.01.13	Narrow feet	HP:0001786	Narrow foot	Good	
26.01.14	Oedema of feet	HP:0012098	Edema of the dorsum of feet	Good	
26.02.03	Dorsi-flexed hallux	HP:0001765	Hammertoe	OK	Consider a more precise definition
26.05.05	Over-riding toes (including clinodactyly)	HP:0001845	Overlapping toe	OK	Compound term : also Clinodactyly (feet) HP:0001863
27.00.00	BLOOD VESSELS (EXTRACRANIAL)	HP:0002597	Abnormality of the vasculature	OK	0
27.01.00	Blood vessels, general abnormalities	HP:0002597	Abnormality of the vasculature	OK	Note the HPO does not distinguish between extra- and intracranial vessels in the same way!
27.01.01	Aneurysms (extracranial)	HP:0002617	Aneurysm	OK	The HPO has Aneurysmal disease and terms for aortic aneurysm as well as terms for cerebral aneurysms. There is no term such as this one, which does not match with the logic of the HPO!
27.01.06	Cholesterol/lipids, abnormal	HP:0003119	Abnormality of lipid metabolism	OK	Abnormality of lipid metabolism (HP:0003119) and Abnormality of cholesterol metabolism (HP:0003107).
27.01.10	Arteritis	HP:0012089	Arteritis	Good	
28.03.00	Pancreas (endocrine), general abnormalities	HP:0012093	Abnormality of endocrine pancreas physiology	OK	
28.04.03	Parathyroid tumours/hyperplasia	HP:0000828	Abnormality of the parathyroid gland	OK	Composite LDDB Term! Parathyroid hyperplasia (HP:0008208). There is also Parathyroid adenoma (HP:0002897) and  Parathyroid carcinoma (HP:0006780)
28.05.02	Hyper-pituitarism	HP:0010514	Hyperpituitarism	Good	This should be broken down into primary and secondary (We still need to do this in the HPO)
28.05.06	Pituitary tumours	HP:0011750	Neoplasm of the anterior pituitary	?	Note, positerior is separate, probably not meant by this LDDB term though
28.07.01	Ectopic/enlarged thyroid	HP:0000820	Abnormality of the thyroid gland	OK	compound term; we have Goiter (HP:0000853) and Ectopic thyroid (HP:0100028)
28.07.05	Thyroid tumours	HP:0100031	Neoplasm of the thyroid gland	Good	Need to make more precise. HPO has: Thyroid carcinoma (HP:0002890) with the differen possible subtypes (follicular, medullary, papillary) and Thyroid adenoma (HP:0000854)
29.01.10	Lymphomas/leukaemias	HP:0004377	Hematological neoplasm	OK	Leukemia (HP:0001909) and  Lymphoma (HP:0002665)
31.01.03	Multiple joint dislocation	HP:0012095	Multiple joint dislocation	Good	
32.02.02	Amniotic fluid/placenta abnormal	HP:0001197	Abnormality of prenatal development or birth	OK	Compound term: Abnormalities of placenta and umbilical cord (HP:0001194) and Abnormality of the amniotic fluid (HP:0001560) ? mapped to next higher level parent term
32.02.04	Fetal movement - increased/ prenatal seizures	HP:0010519	Increased fetal movement	OK	Increased fetal movement (HP:0010519) and Fetal seizure (HP:0010520) ? as Fetal seizure is at the moment a child of Increased fetal movement, this was chosen as the mapped term here. We might consider moving fetal seizres to be a separate child of the overal parent term Prenatal movement abnormality (HP:0001557) and change the mapping to that term? This would then also include decreased fetal movement terms.
32.02.06	* small for dates - see BUILD	HP:0001511	Intrauterine growth retardation	OK	?
32.03.08	Haemorrhagic disorders in neonate	HP:0001871	Abnormality of  blood and blood-forming tissues	OK	Again, there is no spearate category for neonatal hemorrhagic features. Need to discuss whether this is desirable?
32.03.09	* neonatal seizures - see SEIZURES	HP:0001250	Seizures	no-mapping	?
32.04.04	Percepto-motor delay without MR/or clumsiness	HP:0001270	Motor delay	OK	This is a compound term. The way to say a patient does not have something is to use the modifier NOT. Also, how can one have a perception delay without having MR? And how can one have motor delay without a certain amount of resulting clumsiness in comparison to age dependent norms?
32.04.06	Dyspraxia/apraxia including gait apraxia	HP:0002186	Apraxia	OK	Gait apraxia (HP:0010521) is a child of Apraxia
32.04.09	Dyslexia/alexia	HP:0002167	Neurological speech impairment	OK	Clinically, these two manifestation are quite different! HPO has: Alexia (HP:0010523) and Dyslexia (HP:0010522)
32.05.02	Stereotopy	HP:0000733	Stereotypic behavior	OK	Is this meant by the term Stereotopy?
32.05.12	* sleep disorders incl. apnoea, see PAROXYSMAL	HP:0002360	Sleep disturbance	no-mapping	This is the same as two categories above (LDDB: Sleep disorders excl. Apnoea)?
32.06.01	Neonatal seizure	HP:0001250	Seizures	?	Should this be a term separate from infantile spasms?
32.06.02	Infantile spasms	HP:0011097	Epileptic spasms	Good	League against epilepsy now uses term epileptic spasms instead of infantile spasms
32.06.05	Atonic/akinetic (minor motor)	HP:0002304	Akinesia	OK	We have Akinesia, does this suffice?
32.06.10	Gelastic seizure	HP:0010821	Gelastic seizures	Good	
32.06.11	Partialis continua	HP:0002266	Focal clonic seizures	?	This is a diagnosis, not a feature ? Epilepsia partialis continua. We could map this to focal seizures as this seems to be the feature present in this condition ?
32.06.17	Spasms (not infantile)	HP:0003739	Myoclonic spasms	?	Please clarify what is meant here? Could we perhaps map this to Myoclonic spasms?
32.07.07	Cranial nerve neuralgia or neuropathy	HP:0001291	Abnormality of the cranial nerves	OK	Perhaps best as Abnormality of the cranial nerves (HP:0001291)
32.07.11	Intermittent/periodic weakness, (not hemiplegia)	HP:0003768	Periodic paralysis	OK	HPO has term Periodic paralysis (HP:0003768) Need to define both this and periodic weakness better
32.07.17	Paroxysmal ataxia	HP:0002131	Episodic ataxia	?	Is this the same as Ataxia, episodic (HP:0002131)? Please define more precisely
32.07.19	Intermittent stiffness or rigidity	HP:0002063	Rigidity	?	I am unfamiliar with this, Please define more precisely. Is this cogwhelle rigidity?
32.07.20	Intermittent tremor at rest	HP:0002322	Resting tremor	?	Does this mean the same as Resting tremor (HP:0002322)
32.08.00	CRANIUM, general abnormalities	HP:0002648	Abnormality of calvarial morphology	OK	looking at the subterms this probbly refers to Abnormalities of the skull shape?
32.09.03	Fontanelles of skull, extra	HP:0011328	Abnormality of fontanelles	OK	Will need a more exact description; mapped to parent term; at the moment we don't have a term for ﾄaccesoryﾓ fontanelles do we really need one?
