?term	?property	?value	?source_value	?translation	?translation_status
<http://purl.obolibrary.org/obo/HP_4000148>	<http://www.w3.org/2000/01/rdf-schema#label>	"Hepatic artery hyperplasia"@en	"Portal artery hyperplasia"	"門脈過形成"@ja	"OFFICIAL"
<http://purl.obolibrary.org/obo/HP_0012071>	<http://www.w3.org/2000/01/rdf-schema#label>	"Abnormal circulating acylcarnitine concentration"	"Abnormal circulating acetylcarnitine concentration"	"アセチルカルニチン代謝の異常"@ja	"OFFICIAL"
<http://purl.obolibrary.org/obo/HP_4000147>	<http://www.w3.org/2000/01/rdf-schema#label>	"Abnormal hepatic artery morphology"@en	"Abnormal portal artery morphology"	"門脈形態異常"@ja	"OFFICIAL"
<http://purl.obolibrary.org/obo/HP_0010790>	<http://www.w3.org/2000/01/rdf-schema#label>	"Hypoplasia of the Leydig cells"	"Hyoplasia of the Leydig cells"	"Leydig 細胞低形成"@ja	"OFFICIAL"
<http://purl.obolibrary.org/obo/HP_4000151>	<http://www.w3.org/2000/01/rdf-schema#label>	"History of recent contralateral injury"@en	"History of recent cotralateral injury"	"最近の副傷病歴"@ja	"OFFICIAL"
<http://purl.obolibrary.org/obo/HP_0003234>	<http://www.w3.org/2000/01/rdf-schema#label>	"Decreased circulating carnitine concentration"	"Decreased plasma carnitine"	"血漿カルニチン減少"@ja	"OFFICIAL"
<http://purl.obolibrary.org/obo/HP_0031039>	<http://www.w3.org/2000/01/rdf-schema#label>	"Spermatocyte maturation arrest"	"Early spermatogenesis maturation arrest"	"初期精子形成成熟停止"@ja	"OFFICIAL"
<http://purl.obolibrary.org/obo/HP_0034334>	<http://www.w3.org/2000/01/rdf-schema#label>	"allelic_requirement"	"allelic:requirement"	"対立遺伝子：要求性"@ja	"OFFICIAL"
