defined_class	defined_class_label	biological_process	biological_process_label
http://purl.obolibrary.org/obo/HP_0031380	Abnormal B cell proliferation	http://purl.obolibrary.org/obo/GO_0042100	B cell proliferation
http://purl.obolibrary.org/obo/HP_0011400	Abnormal CNS myelination	http://purl.obolibrary.org/obo/GO_0022010	central nervous system myelination
http://purl.obolibrary.org/obo/HP_0410035	Abnormal T cell activation	http://purl.obolibrary.org/obo/GO_0042110	T cell activation
http://purl.obolibrary.org/obo/HP_0031379	Abnormal T cell proliferation	http://purl.obolibrary.org/obo/GO_0042098	T cell proliferation
http://purl.obolibrary.org/obo/HP_0010929	Abnormal blood cation concentration	http://purl.obolibrary.org/obo/GO_0055080	cation homeostasis
http://purl.obolibrary.org/obo/HP_0011422	Abnormal blood chloride concentration	http://purl.obolibrary.org/obo/GO_0055064	chloride ion homeostasis
http://purl.obolibrary.org/obo/HP_0010927	Abnormal blood inorganic cation concentration	http://purl.obolibrary.org/obo/GO_0072507	divalent inorganic cation homeostasis
http://purl.obolibrary.org/obo/HP_0010930	Abnormal blood monovalent inorganic cation concentration	http://purl.obolibrary.org/obo/GO_0055067	monovalent inorganic cation homeostasis
http://purl.obolibrary.org/obo/HP_0100529	Abnormal blood phosphate concentration	http://purl.obolibrary.org/obo/GO_0055062	phosphate ion homeostasis
http://purl.obolibrary.org/obo/HP_0008277	Abnormal blood zinc concentration	http://purl.obolibrary.org/obo/GO_0055069	zinc ion homeostasis
http://purl.obolibrary.org/obo/HP_0031377	Abnormal cell proliferation	http://purl.obolibrary.org/obo/GO_0008283	cell population proliferation
http://purl.obolibrary.org/obo/HP_0010909	Abnormal circulating arginine concentration	http://purl.obolibrary.org/obo/GO_0006525	arginine metabolic process
http://purl.obolibrary.org/obo/HP_0004338	Abnormal circulating aromatic amino acid concentration	http://purl.obolibrary.org/obo/GO_0009072	aromatic amino acid family metabolic process
http://purl.obolibrary.org/obo/HP_0010899	Abnormal circulating aspartate family amino acid concentration	http://purl.obolibrary.org/obo/GO_0009066	aspartate family amino acid metabolic process
http://purl.obolibrary.org/obo/HP_0010892	Abnormal circulating branched chain amino acid concentration	http://purl.obolibrary.org/obo/GO_0009081	branched-chain amino acid metabolic process
http://purl.obolibrary.org/obo/HP_0004363	Abnormal circulating calcium concentration	http://purl.obolibrary.org/obo/GO_0055074	calcium ion homeostasis
http://purl.obolibrary.org/obo/HP_0011013	Abnormal circulating carbohydrate concentration	http://purl.obolibrary.org/obo/GO_0005975	carbohydrate metabolic process
http://purl.obolibrary.org/obo/HP_0004354	Abnormal circulating carboxylic acid concentration	http://purl.obolibrary.org/obo/GO_0019752	carboxylic acid metabolic process
http://purl.obolibrary.org/obo/HP_0010967	Abnormal circulating carnitine concentration	http://purl.obolibrary.org/obo/GO_0009437	carnitine metabolic process
http://purl.obolibrary.org/obo/HP_0011965	Abnormal circulating citrulline concentration	http://purl.obolibrary.org/obo/GO_0000052	citrulline metabolic process
http://purl.obolibrary.org/obo/HP_0012113	Abnormal circulating creatine concentration	http://purl.obolibrary.org/obo/GO_0006600	creatine metabolic process
http://purl.obolibrary.org/obo/HP_0010918	Abnormal circulating cysteine concentration	http://purl.obolibrary.org/obo/GO_0006534	cysteine metabolic process
http://purl.obolibrary.org/obo/HP_0010995	Abnormal circulating dicarboxylic acid concentration	http://purl.obolibrary.org/obo/GO_0043648	dicarboxylic acid metabolic process
http://purl.obolibrary.org/obo/HP_0004359	Abnormal circulating fatty-acid concentration	http://purl.obolibrary.org/obo/GO_0006631	fatty acid metabolic process
http://purl.obolibrary.org/obo/HP_0010903	Abnormal circulating glutamine concentration	http://purl.obolibrary.org/obo/GO_0006541	glutamine metabolic process
http://purl.obolibrary.org/obo/HP_0010902	Abnormal circulating glutamine family amino acid concentration	http://purl.obolibrary.org/obo/GO_0009064	glutamine family amino acid metabolic process
http://purl.obolibrary.org/obo/HP_0010895	Abnormal circulating glycine concentration	http://purl.obolibrary.org/obo/GO_0006544	glycine metabolic process
http://purl.obolibrary.org/obo/HP_0010904	Abnormal circulating histidine concentration	http://purl.obolibrary.org/obo/GO_0006547	histidine metabolic process
http://purl.obolibrary.org/obo/HP_0010919	Abnormal circulating homocysteine concentration	http://purl.obolibrary.org/obo/GO_0050667	homocysteine metabolic process
http://purl.obolibrary.org/obo/HP_0010912	Abnormal circulating isoleucine concentration	http://purl.obolibrary.org/obo/GO_0006549	isoleucine metabolic process
http://purl.obolibrary.org/obo/HP_0004357	Abnormal circulating leucine concentration	http://purl.obolibrary.org/obo/GO_0006551	leucine metabolic process
http://purl.obolibrary.org/obo/HP_0010964	Abnormal circulating long-chain fatty-acid concentration	http://purl.obolibrary.org/obo/GO_0001676	long-chain fatty acid metabolic process
http://purl.obolibrary.org/obo/HP_0010908	Abnormal circulating lysine concentration	http://purl.obolibrary.org/obo/GO_0006553	lysine metabolic process
http://purl.obolibrary.org/obo/HP_0010901	Abnormal circulating methionine concentration	http://purl.obolibrary.org/obo/GO_0006555	methionine metabolic process
http://purl.obolibrary.org/obo/HP_0010996	Abnormal circulating monocarboxylic acid concentration	http://purl.obolibrary.org/obo/GO_0032787	monocarboxylic acid metabolic process
http://purl.obolibrary.org/obo/HP_0010932	Abnormal circulating nucleobase concentration	http://purl.obolibrary.org/obo/GO_0009112	nucleobase metabolic process
http://purl.obolibrary.org/obo/HP_0012025	Abnormal circulating ornithine concentration	http://purl.obolibrary.org/obo/GO_0006591	ornithine metabolic process
http://purl.obolibrary.org/obo/HP_0010893	Abnormal circulating phenylalanine concentration	http://purl.obolibrary.org/obo/GO_0006558	L-phenylalanine metabolic process
http://purl.obolibrary.org/obo/HP_0011012	Abnormal circulating polysaccharide concentration	http://purl.obolibrary.org/obo/GO_0005976	polysaccharide metabolic process
http://purl.obolibrary.org/obo/HP_0010907	Abnormal circulating proline concentration	http://purl.obolibrary.org/obo/GO_0006560	proline metabolic process
http://purl.obolibrary.org/obo/HP_0011023	Abnormal circulating prostaglandin circulation	http://purl.obolibrary.org/obo/GO_0006693	prostaglandin metabolic process
http://purl.obolibrary.org/obo/HP_0004352	Abnormal circulating purine concentration	http://purl.obolibrary.org/obo/GO_0006144	purine nucleobase metabolic process
http://purl.obolibrary.org/obo/HP_0004353	Abnormal circulating pyrimidine concentration	http://purl.obolibrary.org/obo/GO_0006206	pyrimidine nucleobase metabolic process
http://purl.obolibrary.org/obo/HP_0010898	Abnormal circulating sarcosine concentration	http://purl.obolibrary.org/obo/GO_1901052	sarcosine metabolic process
http://purl.obolibrary.org/obo/HP_0012278	Abnormal circulating serine concentration	http://purl.obolibrary.org/obo/GO_0006563	L-serine metabolic process
http://purl.obolibrary.org/obo/HP_0010894	Abnormal circulating serine family amino acid concentration	http://purl.obolibrary.org/obo/GO_0009069	serine family amino acid metabolic process
http://purl.obolibrary.org/obo/HP_0004339	Abnormal circulating sulfur amino acid concentration	http://purl.obolibrary.org/obo/GO_0000096	sulfur amino acid metabolic process
http://purl.obolibrary.org/obo/HP_0010900	Abnormal circulating threonine concentration	http://purl.obolibrary.org/obo/GO_0006566	threonine metabolic process
http://purl.obolibrary.org/obo/HP_0004365	Abnormal circulating tryptophan concentration	http://purl.obolibrary.org/obo/GO_0006568	tryptophan metabolic process
http://purl.obolibrary.org/obo/HP_0010917	Abnormal circulating tyrosine concentration	http://purl.obolibrary.org/obo/GO_0006570	tyrosine metabolic process
http://purl.obolibrary.org/obo/HP_0011022	Abnormal circulating unsaturated fatty acid concentration	http://purl.obolibrary.org/obo/GO_0033559	unsaturated fatty acid metabolic process
http://purl.obolibrary.org/obo/HP_0010914	Abnormal circulating valine concentration	http://purl.obolibrary.org/obo/GO_0006573	valine metabolic process
http://purl.obolibrary.org/obo/HP_0040202	Abnormal consumption behavior	http://purl.obolibrary.org/obo/NBO_0001845	consumption behavior
http://purl.obolibrary.org/obo/HP_0031406	Abnormal cytokine signaling	http://purl.obolibrary.org/obo/GO_0019221	cytokine-mediated signaling pathway
http://purl.obolibrary.org/obo/HP_0030082	Abnormal drinking behavior	http://purl.obolibrary.org/obo/GO_0042756	drinking behavior
http://purl.obolibrary.org/obo/HP_0100738	Abnormal eating behavior	http://purl.obolibrary.org/obo/GO_0042755	eating behavior
http://purl.obolibrary.org/obo/HP_0012875	Abnormal ejaculation	http://purl.obolibrary.org/obo/GO_0042713	sperm ejaculation
http://purl.obolibrary.org/obo/HP_0100851	Abnormal emotion/affect behavior	http://purl.obolibrary.org/obo/NBO_0000003	emotional behavior
http://purl.obolibrary.org/obo/HP_0100852	Abnormal fear/anxiety-related behavior	http://purl.obolibrary.org/obo/NBO_0000018	fear/anxiety related behavior
http://purl.obolibrary.org/obo/HP_0012359	Abnormal fucosylation of O-linked protein glycosylation	http://purl.obolibrary.org/obo/GO_0036066	protein O-linked fucosylation
http://purl.obolibrary.org/obo/HP_0030895	Abnormal gastrointestinal motility	http://purl.obolibrary.org/obo/GO_0014831	gastro-intestinal system smooth muscle contraction
http://purl.obolibrary.org/obo/HP_0011014	Abnormal glucose homeostasis	http://purl.obolibrary.org/obo/GO_0042593	glucose homeostasis
http://purl.obolibrary.org/obo/HP_0004343	Abnormal glycosphingolipid metabolism	http://purl.obolibrary.org/obo/GO_0006687	glycosphingolipid metabolic process
http://purl.obolibrary.org/obo/HP_0012345	Abnormal glycosylation	http://purl.obolibrary.org/obo/GO_0070085	glycosylation
http://purl.obolibrary.org/obo/HP_0032367	Abnormal growth hormone level	http://purl.obolibrary.org/obo/GO_0030252	growth hormone secretion
http://purl.obolibrary.org/obo/HP_0012647	Abnormal inflammatory response	http://purl.obolibrary.org/obo/GO_0006954	inflammatory response
http://purl.obolibrary.org/obo/HP_0002101	Abnormal lung lobation	http://purl.obolibrary.org/obo/GO_0060464	lung lobe formation
http://purl.obolibrary.org/obo/HP_0031378	Abnormal lymphocyte proliferation	http://purl.obolibrary.org/obo/GO_0046651	lymphocyte proliferation
http://purl.obolibrary.org/obo/HP_0012447	Abnormal myelination	http://purl.obolibrary.org/obo/GO_0042552	myelination
http://purl.obolibrary.org/obo/HP_0003130	Abnormal peripheral myelination	http://purl.obolibrary.org/obo/GO_0022011	myelination in peripheral nervous system
http://purl.obolibrary.org/obo/HP_0012347	Abnormal protein N-linked glycosylation	http://purl.obolibrary.org/obo/GO_0006487	protein N-linked glycosylation
http://purl.obolibrary.org/obo/HP_0012358	Abnormal protein O-linked glycosylation	http://purl.obolibrary.org/obo/GO_0006493	protein O-linked glycosylation
http://purl.obolibrary.org/obo/HP_0012346	Abnormal protein glycosylation	http://purl.obolibrary.org/obo/GO_0006486	protein glycosylation
http://purl.obolibrary.org/obo/HP_0011038	Abnormal renal tubular resorption	http://purl.obolibrary.org/obo/GO_0070293	renal absorption
http://purl.obolibrary.org/obo/HP_0012535	Abnormal synaptic transmission	http://purl.obolibrary.org/obo/GO_0007268	chemical synaptic transmission
http://purl.obolibrary.org/obo/HP_0012590	Abnormal urine output	http://purl.obolibrary.org/obo/GO_0060073	micturition
http://purl.obolibrary.org/obo/HP_0007670	Abnormal vestibulo-ocular reflex	http://purl.obolibrary.org/obo/NBO_0000416	vestibulo-ocular reflex
http://purl.obolibrary.org/obo/HP_0003254	Abnormality of DNA repair	http://purl.obolibrary.org/obo/GO_0006281	DNA repair
http://purl.obolibrary.org/obo/HP_0000816	Abnormality of Krebs cycle metabolism	http://purl.obolibrary.org/obo/GO_0072350	tricarboxylic acid metabolic process
http://purl.obolibrary.org/obo/HP_0004337	Abnormality of amino acid metabolism	http://purl.obolibrary.org/obo/GO_0006520	cellular amino acid metabolic process
http://purl.obolibrary.org/obo/HP_0011028	Abnormality of blood circulation	http://purl.obolibrary.org/obo/GO_0008015	blood circulation
http://purl.obolibrary.org/obo/HP_0011115	Abnormality of chemokine secretion	http://purl.obolibrary.org/obo/GO_0032602	chemokine production
http://purl.obolibrary.org/obo/HP_0011019	Abnormality of chromosome condensation	http://purl.obolibrary.org/obo/GO_0030261	chromosome condensation
http://purl.obolibrary.org/obo/HP_0011113	Abnormality of cytokine secretion	http://purl.obolibrary.org/obo/GO_0001816	cytokine production
http://purl.obolibrary.org/obo/HP_0000496	Abnormality of eye movement	http://purl.obolibrary.org/obo/NBO_0000444	eye movement
http://purl.obolibrary.org/obo/HP_0011032	Abnormality of fluid regulation	http://purl.obolibrary.org/obo/GO_0050878	regulation of body fluid levels
http://purl.obolibrary.org/obo/HP_0010969	Abnormality of glycolipid metabolism	http://purl.obolibrary.org/obo/GO_0006664	glycolipid metabolic process
http://purl.obolibrary.org/obo/HP_0010968	Abnormality of liposaccharide metabolism	http://purl.obolibrary.org/obo/GO_1903509	liposaccharide metabolic process
http://purl.obolibrary.org/obo/HP_0100022	Abnormality of movement	http://purl.obolibrary.org/obo/NBO_0000403	voluntary movement behavior
http://purl.obolibrary.org/obo/HP_0011020	Abnormality of mucopolysaccharide metabolism	http://purl.obolibrary.org/obo/GO_1903510	mucopolysaccharide metabolic process
http://purl.obolibrary.org/obo/HP_0002269	Abnormality of neuronal migration	http://purl.obolibrary.org/obo/GO_0001764	neuron migration
http://purl.obolibrary.org/obo/HP_0011036	Abnormality of renal excretion	http://purl.obolibrary.org/obo/GO_0003014	renal system process
http://purl.obolibrary.org/obo/HP_0100755	Abnormality of salivation	http://purl.obolibrary.org/obo/GO_0046541	saliva secretion
http://purl.obolibrary.org/obo/HP_0004358	Abnormality of superoxide metabolism	http://purl.obolibrary.org/obo/GO_0006801	superoxide metabolic process
http://purl.obolibrary.org/obo/HP_0004370	Abnormality of temperature regulation	http://purl.obolibrary.org/obo/GO_0001659	temperature homeostasis
http://purl.obolibrary.org/obo/HP_0011018	Abnormality of the cell cycle	http://purl.obolibrary.org/obo/GO_0007049	cell cycle
http://purl.obolibrary.org/obo/HP_0010990	Abnormality of the common coagulation pathway	http://purl.obolibrary.org/obo/GO_0072377	blood coagulation, common pathway
http://purl.obolibrary.org/obo/HP_0010988	Abnormality of the extrinsic pathway	http://purl.obolibrary.org/obo/GO_0007598	blood coagulation, extrinsic pathway
http://purl.obolibrary.org/obo/HP_0010989	Abnormality of the intrinsic pathway	http://purl.obolibrary.org/obo/GO_0007597	blood coagulation, intrinsic pathway
http://purl.obolibrary.org/obo/HP_0000140	Abnormality of the menstrual cycle	http://purl.obolibrary.org/obo/GO_0042703	menstruation
http://purl.obolibrary.org/obo/HP_0000504	Abnormality of vision	http://purl.obolibrary.org/obo/GO_0007601	visual perception
http://purl.obolibrary.org/obo/HP_0008372	Abnormality of vitamin A metabolism	http://purl.obolibrary.org/obo/GO_0006776	vitamin A metabolic process
http://purl.obolibrary.org/obo/HP_0004341	Abnormality of vitamin B12 metabolism	http://purl.obolibrary.org/obo/GO_0009235	cobalamin metabolic process
http://purl.obolibrary.org/obo/HP_0100509	Abnormality of vitamin C metabolism	http://purl.obolibrary.org/obo/GO_0019852	L-ascorbic acid metabolic process
http://purl.obolibrary.org/obo/HP_0100511	Abnormality of vitamin D metabolism	http://purl.obolibrary.org/obo/GO_0042359	vitamin D metabolic process
http://purl.obolibrary.org/obo/HP_0100514	Abnormality of vitamin E metabolism	http://purl.obolibrary.org/obo/GO_0042360	vitamin E metabolic process
http://purl.obolibrary.org/obo/HP_0100831	Abnormality of vitamin K metabolism	http://purl.obolibrary.org/obo/GO_0042373	vitamin K metabolic process
http://purl.obolibrary.org/obo/HP_0100508	Abnormality of vitamin metabolism	http://purl.obolibrary.org/obo/GO_0006766	vitamin metabolic process
http://purl.obolibrary.org/obo/HP_0000718	Aggressive behavior	http://purl.obolibrary.org/obo/NBO_0000015	aggressive behavior
http://purl.obolibrary.org/obo/HP_0000713	Agitation	http://purl.obolibrary.org/obo/NBO_0000129	agitation behavior
http://purl.obolibrary.org/obo/HP_0000739	Anxiety	http://purl.obolibrary.org/obo/NBO_0000092	anxiety-related behavior
http://purl.obolibrary.org/obo/HP_0000708	Behavioral abnormality	http://purl.obolibrary.org/obo/NBO_0000313	behavior process
http://purl.obolibrary.org/obo/HP_0040012	Chromosome breakage	http://purl.obolibrary.org/obo/GO_0031052	programmed DNA elimination by chromosome breakage
http://purl.obolibrary.org/obo/HP_0100639	Erectile dysfunction	http://purl.obolibrary.org/obo/GO_0043084	penile erection
http://purl.obolibrary.org/obo/HP_0004345	Ganglioside accumulation	http://purl.obolibrary.org/obo/GO_0001573	ganglioside metabolic process
http://purl.obolibrary.org/obo/HP_0001507	Growth abnormality	http://purl.obolibrary.org/obo/GO_0040007	growth
http://purl.obolibrary.org/obo/HP_0010933	Hyperxanthinemia	http://purl.obolibrary.org/obo/GO_0046110	xanthine metabolic process
http://purl.obolibrary.org/obo/HP_0003540	Impaired platelet aggregation	http://purl.obolibrary.org/obo/GO_0070527	platelet aggregation
http://purl.obolibrary.org/obo/HP_0007772	Impaired smooth pursuit	http://purl.obolibrary.org/obo/NBO_0000446	visual pursuit
http://purl.obolibrary.org/obo/HP_0000735	Impaired social interactions	http://purl.obolibrary.org/obo/NBO_0000011	social behavior
http://purl.obolibrary.org/obo/HP_0100710	Impulsivity	http://purl.obolibrary.org/obo/NBO_0000119	impulsive behavior
http://purl.obolibrary.org/obo/HP_0000719	Inappropriate behavior	http://purl.obolibrary.org/obo/NBO_0001786	regulation of behavior
http://purl.obolibrary.org/obo/HP_0000748	Inappropriate laughter	http://purl.obolibrary.org/obo/NBO_0000617	laughing behavior
http://purl.obolibrary.org/obo/HP_0008768	Inappropriate sexual behavior	http://purl.obolibrary.org/obo/NBO_0000605	sexual inhibition
http://purl.obolibrary.org/obo/HP_0004305	Involuntary movements	http://purl.obolibrary.org/obo/GO_0003010	voluntary skeletal muscle contraction
http://purl.obolibrary.org/obo/HP_0000737	Irritability	http://purl.obolibrary.org/obo/NBO_0000128	irritability behavior
http://purl.obolibrary.org/obo/HP_0002024	Malabsorption	http://purl.obolibrary.org/obo/GO_0050892	intestinal absorption
http://purl.obolibrary.org/obo/HP_0045005	Neural tube defect	http://purl.obolibrary.org/obo/GO_0001843	neural tube closure
http://purl.obolibrary.org/obo/HP_0000639	Nystagmus	http://purl.obolibrary.org/obo/NBO_0000417	physiologic nystagmus
http://purl.obolibrary.org/obo/HP_0002033	Poor suck	http://purl.obolibrary.org/obo/NBO_0000054	suckling behavior
http://purl.obolibrary.org/obo/HP_0008760	Violent behavior	http://purl.obolibrary.org/obo/NBO_0000120	physical aggression behavior
